[INIT] BLAS threading configured to use 32 cores
[INIT] This will accelerate SVM's numerical operations
[INIT] threadpoolctl available - BLAS threading will be controlled at runtime

================================================================================
FILTER COMPARISON EXPERIMENT
================================================================================
Configuration: Window=170, Overlap=5
Experiments: (1) No Filter, (2) Lowpass 5Hz
Run ID: 20260205_150912
================================================================================

CPU Threading Status:
  OMP_NUM_THREADS: 32
  MKL_NUM_THREADS: 32
  OPENBLAS_NUM_THREADS: 32
  Available cores: 32
  Status: ✓ Multi-threading ENABLED for SVM/numpy operations

Loading dataset...
Loading dataset:   0%|          | 0/1 [00:00<?, ?it/s]Loading dataset: 100%|██████████| 1/1 [00:00<00:00, 30840.47it/s]
Loading dataset:   0%|          | 0/21 [00:00<?, ?it/s]Loading dataset:  14%|█▍        | 3/21 [00:00<00:00, 23.38it/s]Loading dataset:  29%|██▊       | 6/21 [00:00<00:00, 19.60it/s]Loading dataset:  38%|███▊      | 8/21 [00:00<00:00, 15.97it/s]Loading dataset:  57%|█████▋    | 12/21 [00:00<00:00, 14.91it/s]Loading dataset:  71%|███████▏  | 15/21 [00:00<00:00, 16.48it/s]Loading dataset:  81%|████████  | 17/21 [00:01<00:00, 11.31it/s]Loading dataset:  90%|█████████ | 19/21 [00:01<00:00,  6.90it/s]Loading dataset: 100%|██████████| 21/21 [00:02<00:00,  7.60it/s]Loading dataset: 100%|██████████| 21/21 [00:02<00:00, 10.30it/s]
Loading dataset: 0it [00:00, ?it/s]Loading dataset: 0it [00:00, ?it/s]
Loading dataset: 0it [00:00, ?it/s]Loading dataset: 0it [00:00, ?it/s]
Loading dataset: 0it [00:00, ?it/s]Loading dataset: 0it [00:00, ?it/s]
Loading dataset: 0it [00:00, ?it/s]Loading dataset: 0it [00:00, ?it/s]
Loading dataset: 0it [00:00, ?it/s]Loading dataset: 0it [00:00, ?it/s]
Loading dataset: 0it [00:00, ?it/s]Loading dataset: 0it [00:00, ?it/s]
Loading dataset: 0it [00:00, ?it/s]Loading dataset: 0it [00:00, ?it/s]
Loading dataset: 0it [00:00, ?it/s]Loading dataset: 0it [00:00, ?it/s]
Loading dataset: 0it [00:00, ?it/s]Loading dataset: 0it [00:00, ?it/s]
Loading dataset: 0it [00:00, ?it/s]Loading dataset: 0it [00:00, ?it/s]
Loading dataset: 0it [00:00, ?it/s]Loading dataset: 0it [00:00, ?it/s]
Loading dataset: 0it [00:00, ?it/s]Loading dataset: 0it [00:00, ?it/s]
Loading dataset: 0it [00:00, ?it/s]Loading dataset: 0it [00:00, ?it/s]
Loading dataset: 0it [00:00, ?it/s]Loading dataset: 0it [00:00, ?it/s]
Loading dataset: 0it [00:00, ?it/s]Loading dataset: 0it [00:00, ?it/s]
Loading dataset: 0it [00:00, ?it/s]Loading dataset: 0it [00:00, ?it/s]
Loading dataset: 0it [00:00, ?it/s]Loading dataset: 0it [00:00, ?it/s]
Loading dataset: 0it [00:00, ?it/s]Loading dataset: 0it [00:00, ?it/s]
Loading dataset: 0it [00:00, ?it/s]Loading dataset: 0it [00:00, ?it/s]
Loading dataset: 0it [00:00, ?it/s]Loading dataset: 0it [00:00, ?it/s]
Loading dataset: 0it [00:00, ?it/s]Loading dataset: 0it [00:00, ?it/s]
Dataset loaded: 479289 samples, 27 volunteers

================================================================================
EXPERIMENT 1/2: No Filter
================================================================================
Window=170, Overlap=5, Step=165

Preparing windowed data...
Processing users:   0%|          | 0/27 [00:00<?, ?it/s]Processing users:   4%|▎         | 1/27 [00:09<03:57,  9.12s/it]Processing users:   7%|▋         | 2/27 [00:11<02:04,  5.00s/it]Processing users:  11%|█         | 3/27 [00:12<01:19,  3.32s/it]Processing users:  15%|█▍        | 4/27 [00:14<01:00,  2.64s/it]Processing users:  19%|█▊        | 5/27 [00:14<00:43,  1.97s/it]Processing users:  22%|██▏       | 6/27 [00:15<00:33,  1.59s/it]Processing users:  26%|██▌       | 7/27 [00:16<00:25,  1.30s/it]Processing users:  30%|██▉       | 8/27 [00:17<00:21,  1.11s/it]Processing users:  33%|███▎      | 9/27 [00:17<00:17,  1.05it/s]Processing users:  37%|███▋      | 10/27 [00:18<00:14,  1.18it/s]Processing users:  41%|████      | 11/27 [00:18<00:12,  1.31it/s]Processing users:  44%|████▍     | 12/27 [00:19<00:08,  1.72it/s]Processing users:  48%|████▊     | 13/27 [00:19<00:06,  2.20it/s]Processing users:  93%|█████████▎| 25/27 [00:19<00:00, 11.08it/s]Processing users: 100%|██████████| 27/27 [00:19<00:00, 10.95it/s]Processing users: 100%|██████████| 27/27 [00:19<00:00,  1.37it/s]
Generated 94960 samples from 27 volunteers
Feature shape: (94960, 18)

Training models (Leave-One-Group-Out CV)...
  0%|          | 0/27 [00:00<?, ?it/s]  4%|▎         | 1/27 [00:38<16:38, 38.40s/it]  7%|▋         | 2/27 [01:02<12:22, 29.70s/it] 11%|█         | 3/27 [01:25<10:43, 26.83s/it] 15%|█▍        | 4/27 [01:48<09:46, 25.51s/it] 19%|█▊        | 5/27 [02:12<09:06, 24.86s/it] 22%|██▏       | 6/27 [02:36<08:31, 24.37s/it] 26%|██▌       | 7/27 [03:01<08:14, 24.72s/it] 30%|██▉       | 8/27 [03:26<07:51, 24.80s/it] 33%|███▎      | 9/27 [03:49<07:17, 24.29s/it] 37%|███▋      | 10/27 [04:12<06:46, 23.88s/it] 41%|████      | 11/27 [04:41<06:45, 25.36s/it] 44%|████▍     | 12/27 [05:04<06:12, 24.85s/it] 48%|████▊     | 13/27 [05:35<06:10, 26.46s/it] 52%|█████▏    | 14/27 [05:58<05:32, 25.55s/it] 56%|█████▌    | 15/27 [06:22<04:59, 24.96s/it] 59%|█████▉    | 16/27 [06:45<04:28, 24.43s/it] 63%|██████▎   | 17/27 [07:08<04:01, 24.13s/it] 67%|██████▋   | 18/27 [07:35<03:44, 24.99s/it] 70%|███████   | 19/27 [07:58<03:15, 24.42s/it] 74%|███████▍  | 20/27 [08:21<02:48, 24.00s/it] 78%|███████▊  | 21/27 [08:47<02:27, 24.54s/it] 81%|████████▏ | 22/27 [09:12<02:03, 24.67s/it] 85%|████████▌ | 23/27 [09:37<01:39, 24.85s/it] 89%|████████▉ | 24/27 [10:03<01:15, 25.01s/it] 93%|█████████▎| 25/27 [10:28<00:50, 25.10s/it] 96%|█████████▋| 26/27 [10:51<00:24, 24.48s/it]100%|██████████| 27/27 [11:15<00:00, 24.32s/it]100%|██████████| 27/27 [11:15<00:00, 25.02s/it]

✓ Experiment 1 Complete:
  SVM F1: 0.4811
  RF  F1: 0.4564
  DT  F1: 0.3953

================================================================================
EXPERIMENT 2/2: Lowpass 5Hz
================================================================================
Window=170, Overlap=5, Step=165

Preparing windowed data...
Applying sensor filtering...
[FILTER] Applying Low-pass Filter (cutoff=5Hz, order=4)
Processing users:   0%|          | 0/27 [00:00<?, ?it/s]Processing users:   4%|▎         | 1/27 [00:09<03:59,  9.21s/it]Processing users:   7%|▋         | 2/27 [00:11<02:05,  5.04s/it]Processing users:  11%|█         | 3/27 [00:12<01:20,  3.34s/it]Processing users:  15%|█▍        | 4/27 [00:14<01:00,  2.65s/it]Processing users:  19%|█▊        | 5/27 [00:15<00:43,  1.98s/it]Processing users:  22%|██▏       | 6/27 [00:15<00:33,  1.60s/it]Processing users:  26%|██▌       | 7/27 [00:16<00:26,  1.32s/it]Processing users:  30%|██▉       | 8/27 [00:17<00:21,  1.13s/it]Processing users:  33%|███▎      | 9/27 [00:17<00:17,  1.03it/s]Processing users:  37%|███▋      | 10/27 [00:18<00:14,  1.18it/s]Processing users:  41%|████      | 11/27 [00:19<00:12,  1.31it/s]Processing users:  44%|████▍     | 12/27 [00:19<00:08,  1.71it/s]Processing users:  48%|████▊     | 13/27 [00:19<00:06,  2.19it/s]Processing users:  93%|█████████▎| 25/27 [00:19<00:00, 11.02it/s]Processing users: 100%|██████████| 27/27 [00:19<00:00, 10.87it/s]Processing users: 100%|██████████| 27/27 [00:19<00:00,  1.36it/s]
Generated 94960 samples from 27 volunteers
Feature shape: (94960, 18)

Training models (Leave-One-Group-Out CV)...
  0%|          | 0/27 [00:00<?, ?it/s]  4%|▎         | 1/27 [00:36<15:55, 36.74s/it]  7%|▋         | 2/27 [00:59<11:57, 28.69s/it] 11%|█         | 3/27 [01:22<10:26, 26.10s/it] 15%|█▍        | 4/27 [01:45<09:31, 24.84s/it] 19%|█▊        | 5/27 [02:08<08:52, 24.18s/it] 22%|██▏       | 6/27 [02:31<08:19, 23.79s/it] 26%|██▌       | 7/27 [02:57<08:05, 24.28s/it] 30%|██▉       | 8/27 [03:21<07:44, 24.44s/it] 33%|███▎      | 9/27 [03:44<07:11, 23.95s/it] 37%|███▋      | 10/27 [04:07<06:42, 23.65s/it] 41%|████      | 11/27 [04:36<06:41, 25.11s/it] 44%|████▍     | 12/27 [05:00<06:12, 24.81s/it] 48%|████▊     | 13/27 [05:29<06:05, 26.14s/it] 52%|█████▏    | 14/27 [05:53<05:30, 25.41s/it] 56%|█████▌    | 15/27 [06:16<04:58, 24.88s/it] 59%|█████▉    | 16/27 [06:40<04:30, 24.61s/it] 63%|██████▎   | 17/27 [07:04<04:02, 24.21s/it] 67%|██████▋   | 18/27 [07:30<03:44, 24.97s/it] 70%|███████   | 19/27 [07:53<03:15, 24.39s/it] 74%|███████▍  | 20/27 [08:17<02:48, 24.02s/it] 78%|███████▊  | 21/27 [08:42<02:27, 24.51s/it] 81%|████████▏ | 22/27 [09:07<02:03, 24.72s/it] 85%|████████▌ | 23/27 [09:33<01:39, 25.00s/it] 89%|████████▉ | 24/27 [09:58<01:15, 25.13s/it] 93%|█████████▎| 25/27 [10:24<00:50, 25.17s/it] 96%|█████████▋| 26/27 [10:47<00:24, 24.58s/it]100%|██████████| 27/27 [11:11<00:00, 24.43s/it]100%|██████████| 27/27 [11:11<00:00, 24.87s/it]

✓ Experiment 2 Complete:
  SVM F1: 0.4811
  RF  F1: 0.4638
  DT  F1: 0.3877

================================================================================
COMPARISON SUMMARY
================================================================================
experiment_name  window_size  overlap  step_size  num_samples   svm_f1    rf_f1    dt_f1
      No Filter          170        5        165        94960 0.481123 0.456432 0.395310
    Lowpass 5Hz          170        5        165        94960 0.481121 0.463844 0.387721

================================================================================
FILTER IMPACT ANALYSIS
================================================================================

Baseline (No Filter):
  SVM: 0.4811
  RF:  0.4564
  DT:  0.3953

Filtered (Lowpass 5Hz):
  SVM: 0.4811 (-0.00%)
  RF:  0.4638 (+0.74%)
  DT:  0.3877 (-0.76%)

✓ Results saved: /home/odin/achal/Pervasive-Computing-for-Health/tutorial_3/results/comparison_20260205_150912/comparison_results_20260205_150912.csv

================================================================================
GENERATING PLOTS
================================================================================
Traceback (most recent call last):
  File "/home/odin/achal/Pervasive-Computing-for-Health/tutorial_3/single_experiment.py", line 279, in <module>
    main()
  File "/home/odin/achal/Pervasive-Computing-for-Health/tutorial_3/single_experiment.py", line 259, in main
    plot_comparison(results_df, output_dir, timestamp)
  File "/home/odin/achal/Pervasive-Computing-for-Health/tutorial_3/single_experiment.py", line 74, in plot_comparison
    ax1.set_ylim(0, max(results_df[['svm_f1', 'rf_f1', 'dt_f1']].max().max()) * 1.15)
TypeError: 'numpy.float64' object is not iterable
