[INIT] Forced BLAS library to use 32 threads (set env vars)
[INIT] BLAS threading configured to use 32 cores
[INIT] This will accelerate SVM's numerical operations
[INIT] threadpoolctl available - BLAS threading will be controlled at runtime

================================================================================
ACTIVITY RECOGNITION WINDOWING PARAMETER OPTIMIZATION
================================================================================
Start: 2026-02-05 16:35:29
Run ID: 20260205_163529
================================================================================

Configuring CPU threading...

CPU Threading Status:
  OMP_NUM_THREADS: 32
  MKL_NUM_THREADS: 32
  OPENBLAS_NUM_THREADS: 32
  Available cores: 32
  Status: ✓ Multi-threading ENABLED for SVM/numpy operations

CPU Information:
  Physical cores: 16
  Logical cores (threads): 32
  Current usage: 0.2%
  Available memory: 85.23 GB
  Total memory: 91.94 GB

================================================================================
LOADING DATASET
================================================================================
Zip file: /home/odin/achal/Pervasive-Computing-for-Health/tutorial_3/adl_dataset
Extract to: /home/odin/achal/Pervasive-Computing-for-Health/tutorial_3/adl_dataset_extracted
Sampling frequency: 32 Hz

[INFO] Dataset already extracted, skipping extraction...
Loading dataset:   0%|          | 0/1 [00:00<?, ?it/s]Loading dataset: 100%|██████████| 1/1 [00:00<00:00, 31068.92it/s]
Loading dataset:   0%|          | 0/21 [00:00<?, ?it/s]Loading dataset:  14%|█▁        | 3/21 [00:00<00:00, 23.42it/s]Loading dataset:  29%|██▊       | 6/21 [00:00<00:00, 19.70it/s]Loading dataset:  43%|████▎     | 9/21 [00:00<00:00, 17.45it/s]Loading dataset:  57%|█████▋    | 12/21 [00:00<00:00, 14.44it/s]Loading dataset:  67%|██████▋   | 14/21 [00:00<00:00, 15.60it/s]Loading dataset:  76%|███████▌  | 16/21 [00:01<00:00, 10.05it/s]Loading dataset:  86%|████████▌ | 18/21 [00:01<00:00,  8.85it/s]Loading dataset:  95%|█████████▌| 20/21 [00:01<00:00,  6.92it/s]Loading dataset: 100%|██████████| 21/21 [00:02<00:00, 10.30it/s]
Loading dataset: 0it [00:00, ?it/s]Loading dataset: 0it [00:00, ?it/s]
Loading dataset: 0it [00:00, ?it/s]Loading dataset: 0it [00:00, ?it/s]
Loading dataset: 0it [00:00, ?it/s]Loading dataset: 0it [00:00, ?it/s]
Loading dataset: 0it [00:00, ?it/s]Loading dataset: 0it [00:00, ?it/s]
Loading dataset: 0it [00:00, ?it/s]Loading dataset: 0it [00:00, ?it/s]
Loading dataset: 0it [00:00, ?it/s]Loading dataset: 0it [00:00, ?it/s]
Loading dataset: 0it [00:00, ?it/s]Loading dataset: 0it [00:00, ?it/s]
Loading dataset: 0it [00:00, ?it/s]Loading dataset: 0it [00:00, ?it/s]
Loading dataset: 0it [00:00, ?it/s]Loading dataset: 0it [00:00, ?it/s]
Loading dataset: 0it [00:00, ?it/s]Loading dataset: 0it [00:00, ?it/s]
Loading dataset: 0it [00:00, ?it/s]Loading dataset: 0it [00:00, ?it/s]
Loading dataset: 0it [00:00, ?it/s]Loading dataset: 0it [00:00, ?it/s]
Loading dataset: 0it [00:00, ?it/s]Loading dataset: 0it [00:00, ?it/s]
Loading dataset: 0it [00:00, ?it/s]Loading dataset: 0it [00:00, ?it/s]
Loading dataset: 0it [00:00, ?it/s]Loading dataset: 0it [00:00, ?it/s]
Loading dataset: 0it [00:00, ?it/s]Loading dataset: 0it [00:00, ?it/s]
Loading dataset: 0it [00:00, ?it/s]Loading dataset: 0it [00:00, ?it/s]
Loading dataset: 0it [00:00, ?it/s]Loading dataset: 0it [00:00, ?it/s]
Loading dataset: 0it [00:00, ?it/s]Loading dataset: 0it [00:00, ?it/s]
Loading dataset: 0it [00:00, ?it/s]Loading dataset: 0it [00:00, ?it/s]
Loading dataset: 0it [00:00, ?it/s]Loading dataset: 0it [00:00, ?it/s]

Dataset loaded: 479289 samples, 9 columns
Activities: ['brush_teeth' 'pour_water' 'climb_stairs' 'getup_bed' 'comb_hair' 'walk'
 'sitdown_chair' 'standup_chair' 'drink_glass' 'eat_meat' 'liedown_bed'
 'use_telephone' 'eat_soup' 'descend_stairs']
Volunteers: 27

================================================================================
EXPERIMENT 2: Overlap Sweep
================================================================================
Fixed window size: 170
Overlaps to test: [5, 5, 10, 10, 15, 15, 20, 20, 30, 30]
Filter: lowpass
Total configurations: 10
================================================================================
Experiment 2 Progress:   0%|          | 0/10 [00:00<?, ?it/s]
--------------------------------------------------------------------------------
Config 1/10: Window=170, Overlap=5
--------------------------------------------------------------------------------
[FILTER] Applying Low-pass Filter (cutoff=5Hz, order=4)
Generated 94960 samples, training models...

  0%|          | 0/27 [00:00<?, ?it/s][A
  4%|▎         | 1/27 [00:36<15:52, 36.64s/it][A
  7%|▋         | 2/27 [01:00<12:02, 28.88s/it][A
 11%|█         | 3/27 [01:23<10:31, 26.33s/it][A
 15%|█▁        | 4/27 [01:46<09:38, 25.14s/it][A
 19%|█▊        | 5/27 [02:10<08:59, 24.53s/it][A
 22%|██▁       | 6/27 [02:33<08:27, 24.17s/it][A
 26%|██▌       | 7/27 [02:58<08:10, 24.52s/it][A
 30%|██▉       | 8/27 [03:23<07:47, 24.63s/it][A
 33%|███▎      | 9/27 [03:46<07:15, 24.18s/it][A
 37%|███▋      | 10/27 [04:10<06:46, 23.92s/it][A
 41%|████      | 11/27 [04:38<06:44, 25.26s/it][A
 44%|████▁     | 12/27 [05:02<06:12, 24.83s/it][A
 48%|████▊     | 13/27 [05:31<06:06, 26.20s/it][A
 52%|█████▁    | 14/27 [05:55<05:30, 25.44s/it][A
 56%|█████▌    | 15/27 [06:19<04:58, 24.89s/it][A
 59%|█████▉    | 16/27 [06:42<04:29, 24.47s/it][A
 63%|██████▎   | 17/27 [07:05<04:01, 24.13s/it][A
 67%|██████▋   | 18/27 [07:32<03:44, 24.97s/it][A
 70%|███████   | 19/27 [07:55<03:15, 24.38s/it][A
 74%|███████▁  | 20/27 [08:19<02:48, 24.02s/it][A
 78%|███████▊  | 21/27 [08:44<02:26, 24.48s/it][A
 81%|████████▁ | 22/27 [09:09<02:02, 24.59s/it][A
 85%|████████▌ | 23/27 [09:34<01:39, 24.88s/it][A
 89%|████████▉ | 24/27 [10:00<01:14, 24.96s/it][A
 93%|█████████▎| 25/27 [10:25<00:50, 25.08s/it][A
 96%|█████████▋| 26/27 [10:48<00:24, 24.50s/it][A
100%|██████████| 27/27 [11:12<00:00, 24.28s/it][A100%|██████████| 27/27 [11:12<00:00, 24.90s/it]
Experiment 2 Progress:  10%|█         | 1/10 [11:32<1:43:49, 692.21s/it]✓ Complete - SVM F1: 0.4811, DT F1: 0.3794, RF F1: 0.4638

--------------------------------------------------------------------------------
Config 1/10: Window=170, Overlap=5
--------------------------------------------------------------------------------
[FILTER] Applying Low-pass Filter (cutoff=5Hz, order=4)
Generated 94960 samples, training models...

  0%|          | 0/27 [00:00<?, ?it/s][A
  4%|▎         | 1/27 [00:36<15:53, 36.67s/it][A
  7%|▋         | 2/27 [00:59<11:59, 28.80s/it][A
 11%|█         | 3/27 [01:23<10:32, 26.35s/it][A
 15%|█▁        | 4/27 [01:46<09:36, 25.06s/it][A
 19%|█▊        | 5/27 [02:09<08:57, 24.45s/it][A
 22%|██▁       | 6/27 [02:33<08:25, 24.08s/it][A
 26%|██▌       | 7/27 [02:58<08:09, 24.48s/it][A
 30%|██▉       | 8/27 [03:23<07:46, 24.58s/it][A
 33%|███▎      | 9/27 [03:46<07:14, 24.15s/it][A
 37%|███▋      | 10/27 [04:09<06:44, 23.80s/it][A
 41%|████      | 11/27 [04:38<06:44, 25.29s/it][A
 44%|████▁     | 12/27 [05:02<06:14, 24.97s/it][A
 48%|████▊     | 13/27 [05:31<06:08, 26.32s/it][A
 52%|█████▁    | 14/27 [05:55<05:31, 25.50s/it][A
 56%|█████▌    | 15/27 [06:19<05:00, 25.01s/it][A
 59%|█████▉    | 16/27 [06:42<04:29, 24.46s/it][A
 63%|██████▎   | 17/27 [07:05<04:01, 24.11s/it][A
 67%|██████▋   | 18/27 [07:32<03:44, 24.90s/it][A
 70%|███████   | 19/27 [07:55<03:14, 24.36s/it][A
 74%|███████▁  | 20/27 [08:18<02:47, 23.99s/it][A
 78%|███████▊  | 21/27 [08:44<02:26, 24.47s/it][A
 81%|████████▁ | 22/27 [09:09<02:03, 24.69s/it][A
 85%|████████▌ | 23/27 [09:35<01:39, 24.93s/it][A
 89%|████████▉ | 24/27 [10:00<01:15, 25.08s/it][A
 93%|█████████▎| 25/27 [10:25<00:50, 25.17s/it][A
 96%|█████████▋| 26/27 [10:49<00:24, 24.68s/it][A
100%|██████████| 27/27 [11:13<00:00, 24.49s/it][A100%|██████████| 27/27 [11:13<00:00, 24.94s/it]
Experiment 2 Progress:  20%|██        | 2/10 [23:05<1:32:23, 692.91s/it]✓ Complete - SVM F1: 0.4811, DT F1: 0.3865, RF F1: 0.4638

--------------------------------------------------------------------------------
Config 3/10: Window=170, Overlap=10
--------------------------------------------------------------------------------
[FILTER] Applying Low-pass Filter (cutoff=5Hz, order=4)
Generated 47491 samples, training models...

  0%|          | 0/27 [00:00<?, ?it/s][A
  4%|▎         | 1/27 [00:10<04:34, 10.54s/it][A
  7%|▋         | 2/27 [00:17<03:35,  8.61s/it][A
 11%|█         | 3/27 [00:25<03:11,  7.98s/it][A
 15%|█▁        | 4/27 [00:32<02:57,  7.70s/it][A
 19%|█▊        | 5/27 [00:39<02:44,  7.50s/it][A
 22%|██▁       | 6/27 [00:46<02:35,  7.39s/it][A
 26%|██▌       | 7/27 [00:54<02:30,  7.50s/it][A
 30%|██▉       | 8/27 [01:02<02:23,  7.56s/it][A
 33%|███▎      | 9/27 [01:09<02:14,  7.46s/it][A
 37%|███▋      | 10/27 [01:16<02:05,  7.38s/it][A
 41%|████      | 11/27 [01:24<02:03,  7.71s/it][A
 44%|████▁     | 12/27 [01:32<01:53,  7.58s/it][A
 48%|████▊     | 13/27 [01:40<01:51,  7.94s/it][A
 52%|█████▁    | 14/27 [01:48<01:41,  7.77s/it][A
 56%|█████▌    | 15/27 [01:55<01:31,  7.63s/it][A
 59%|█████▉    | 16/27 [02:02<01:22,  7.49s/it][A
 63%|██████▎   | 17/27 [02:10<01:14,  7.42s/it][A
 67%|██████▋   | 18/27 [02:18<01:08,  7.61s/it][A
 70%|███████   | 19/27 [02:25<00:59,  7.47s/it][A
 74%|███████▁  | 20/27 [02:32<00:51,  7.38s/it][A
 78%|███████▊  | 21/27 [02:40<00:45,  7.53s/it][A
 81%|████████▁ | 22/27 [02:48<00:37,  7.58s/it][A
 85%|████████▌ | 23/27 [02:55<00:30,  7.65s/it][A
 89%|████████▉ | 24/27 [03:03<00:23,  7.67s/it][A
 93%|█████████▎| 25/27 [03:11<00:15,  7.71s/it][A
 96%|█████████▋| 26/27 [03:18<00:07,  7.60s/it][A
100%|██████████| 27/27 [03:26<00:00,  7.52s/it][A100%|██████████| 27/27 [03:26<00:00,  7.63s/it]
Experiment 2 Progress:  30%|███       | 3/10 [26:41<55:26, 475.19s/it]  ✓ Complete - SVM F1: 0.4835, DT F1: 0.3782, RF F1: 0.4722

--------------------------------------------------------------------------------
Config 3/10: Window=170, Overlap=10
--------------------------------------------------------------------------------
[FILTER] Applying Low-pass Filter (cutoff=5Hz, order=4)
Generated 47491 samples, training models...

  0%|          | 0/27 [00:00<?, ?it/s][A
  4%|▎         | 1/27 [00:10<04:36, 10.64s/it][A
  7%|▋         | 2/27 [00:17<03:36,  8.66s/it][A
 11%|█         | 3/27 [00:25<03:13,  8.04s/it][A
 15%|█▁        | 4/27 [00:32<02:57,  7.70s/it][A
 19%|█▊        | 5/27 [00:39<02:45,  7.54s/it][A
 22%|██▁       | 6/27 [00:46<02:36,  7.47s/it][A
 26%|██▌       | 7/27 [00:54<02:31,  7.57s/it][A
 30%|██▉       | 8/27 [01:02<02:24,  7.59s/it][A
 33%|███▎      | 9/27 [01:09<02:14,  7.48s/it][A
 37%|███▋      | 10/27 [01:16<02:05,  7.41s/it][A
 41%|████      | 11/27 [01:25<02:04,  7.75s/it][A
 44%|████▁     | 12/27 [01:32<01:54,  7.62s/it][A
 48%|████▊     | 13/27 [01:41<01:51,  8.00s/it][A
 52%|█████▁    | 14/27 [01:48<01:41,  7.79s/it][A
 56%|█████▌    | 15/27 [01:56<01:31,  7.65s/it][A
 59%|█████▉    | 16/27 [02:03<01:22,  7.53s/it][A
 63%|██████▎   | 17/27 [02:10<01:14,  7.44s/it][A
 67%|██████▋   | 18/27 [02:18<01:08,  7.64s/it][A
 70%|███████   | 19/27 [02:26<01:00,  7.52s/it][A
 74%|███████▁  | 20/27 [02:33<00:52,  7.43s/it][A
 78%|███████▊  | 21/27 [02:41<00:45,  7.56s/it][A
 81%|████████▁ | 22/27 [02:48<00:37,  7.59s/it][A
 85%|████████▌ | 23/27 [02:56<00:30,  7.66s/it][A
 89%|████████▉ | 24/27 [03:04<00:22,  7.66s/it][A
 93%|█████████▎| 25/27 [03:11<00:15,  7.67s/it][A
 96%|█████████▋| 26/27 [03:19<00:07,  7.51s/it][A
100%|██████████| 27/27 [03:26<00:00,  7.47s/it][A100%|██████████| 27/27 [03:26<00:00,  7.65s/it]
Experiment 2 Progress:  40%|████      | 4/10 [30:18<37:18, 373.10s/it]✓ Complete - SVM F1: 0.4835, DT F1: 0.3760, RF F1: 0.4722

--------------------------------------------------------------------------------
Config 5/10: Window=170, Overlap=15
--------------------------------------------------------------------------------
[FILTER] Applying Low-pass Filter (cutoff=5Hz, order=4)
Generated 31666 samples, training models...

  0%|          | 0/27 [00:00<?, ?it/s][A
  4%|▎         | 1/27 [00:05<02:13,  5.15s/it][A
  7%|▋         | 2/27 [00:08<01:48,  4.33s/it][A
 11%|█         | 3/27 [00:12<01:37,  4.05s/it][A
 15%|█▁        | 4/27 [00:16<01:30,  3.93s/it][A
 19%|█▊        | 5/27 [00:20<01:25,  3.87s/it][A
 22%|██▁       | 6/27 [00:23<01:20,  3.83s/it][A
 26%|██▌       | 7/27 [00:27<01:17,  3.88s/it][A
 30%|██▉       | 8/27 [00:31<01:13,  3.89s/it][A
 33%|███▎      | 9/27 [00:35<01:09,  3.84s/it][A
 37%|███▋      | 10/27 [00:39<01:04,  3.80s/it][A
 41%|████      | 11/27 [00:43<01:03,  3.97s/it][A
 44%|████▁     | 12/27 [00:47<00:58,  3.93s/it][A
 48%|████▊     | 13/27 [00:51<00:57,  4.08s/it][A
 52%|█████▁    | 14/27 [00:55<00:51,  4.00s/it][A
 56%|█████▌    | 15/27 [00:59<00:47,  3.93s/it][A
 59%|█████▉    | 16/27 [01:03<00:42,  3.87s/it][A
 63%|██████▎   | 17/27 [01:06<00:38,  3.83s/it][A
 67%|██████▋   | 18/27 [01:11<00:35,  3.93s/it][A
 70%|███████   | 19/27 [01:14<00:31,  3.88s/it][A
 74%|███████▁  | 20/27 [01:18<00:26,  3.83s/it][A
 78%|███████▊  | 21/27 [01:22<00:23,  3.91s/it][A
 81%|████████▁ | 22/27 [01:26<00:19,  3.91s/it][A
 85%|████████▌ | 23/27 [01:30<00:15,  3.94s/it][A
 89%|████████▉ | 24/27 [01:34<00:11,  3.94s/it][A
 93%|█████████▎| 25/27 [01:38<00:07,  3.95s/it][A
 96%|█████████▋| 26/27 [01:42<00:03,  3.89s/it][A
100%|██████████| 27/27 [01:46<00:00,  3.86s/it][A100%|██████████| 27/27 [01:46<00:00,  3.93s/it]
Experiment 2 Progress:  50%|█████     | 5/10 [32:11<23:16, 279.24s/it]✓ Complete - SVM F1: 0.4861, DT F1: 0.3839, RF F1: 0.4653

--------------------------------------------------------------------------------
Config 5/10: Window=170, Overlap=15
--------------------------------------------------------------------------------
[FILTER] Applying Low-pass Filter (cutoff=5Hz, order=4)
Generated 31666 samples, training models...

  0%|          | 0/27 [00:00<?, ?it/s][A
  4%|▎         | 1/27 [00:05<02:13,  5.14s/it][A
  7%|▋         | 2/27 [00:08<01:47,  4.30s/it][A
 11%|█         | 3/27 [00:12<01:37,  4.04s/it][A
 15%|█▁        | 4/27 [00:16<01:30,  3.92s/it][A
 19%|█▊        | 5/27 [00:20<01:24,  3.85s/it][A
 22%|██▁       | 6/27 [00:23<01:20,  3.81s/it][A
 26%|██▌       | 7/27 [00:27<01:17,  3.87s/it][A
 30%|██▉       | 8/27 [00:31<01:13,  3.89s/it][A
 33%|███▎      | 9/27 [00:35<01:09,  3.84s/it][A
 37%|███▋      | 10/27 [00:39<01:04,  3.81s/it][A
 41%|████      | 11/27 [00:43<01:03,  3.97s/it][A
 44%|████▁     | 12/27 [00:47<00:58,  3.93s/it][A
 48%|████▊     | 13/27 [00:51<00:57,  4.09s/it][A
 52%|█████▁    | 14/27 [00:55<00:52,  4.01s/it][A
 56%|█████▌    | 15/27 [00:59<00:47,  3.95s/it][A
 59%|█████▉    | 16/27 [01:03<00:42,  3.89s/it][A
 63%|██████▎   | 17/27 [01:06<00:38,  3.86s/it][A
 67%|██████▋   | 18/27 [01:11<00:35,  3.95s/it][A
 70%|███████   | 19/27 [01:14<00:31,  3.88s/it][A
 74%|███████▁  | 20/27 [01:18<00:26,  3.85s/it][A
 78%|███████▊  | 21/27 [01:22<00:23,  3.90s/it][A
 81%|████████▁ | 22/27 [01:26<00:19,  3.92s/it][A
 85%|████████▌ | 23/27 [01:30<00:15,  3.94s/it][A
 89%|████████▉ | 24/27 [01:34<00:11,  3.97s/it][A
 93%|█████████▎| 25/27 [01:38<00:07,  3.97s/it][A
 96%|█████████▋| 26/27 [01:42<00:03,  3.91s/it][A
100%|██████████| 27/27 [01:46<00:00,  3.88s/it][A100%|██████████| 27/27 [01:46<00:00,  3.93s/it]
Experiment 2 Progress:  60%|██████    | 6/10 [34:04<14:50, 222.73s/it]✓ Complete - SVM F1: 0.4861, DT F1: 0.3807, RF F1: 0.4653

--------------------------------------------------------------------------------
Config 7/10: Window=170, Overlap=20
--------------------------------------------------------------------------------
[FILTER] Applying Low-pass Filter (cutoff=5Hz, order=4)
Generated 23757 samples, training models...

  0%|          | 0/27 [00:00<?, ?it/s][A
  4%|▎         | 1/27 [00:03<01:20,  3.09s/it][A
  7%|▋         | 2/27 [00:05<01:07,  2.68s/it][A
 11%|█         | 3/27 [00:07<01:01,  2.55s/it][A
 15%|█▁        | 4/27 [00:10<00:57,  2.49s/it][A
 19%|█▊        | 5/27 [00:12<00:54,  2.46s/it][A
 22%|██▁       | 6/27 [00:15<00:51,  2.44s/it][A
 26%|██▌       | 7/27 [00:17<00:49,  2.47s/it][A
 30%|██▉       | 8/27 [00:20<00:47,  2.48s/it][A
 33%|███▎      | 9/27 [00:22<00:44,  2.45s/it][A
 37%|███▋      | 10/27 [00:24<00:41,  2.43s/it][A
 41%|████      | 11/27 [00:27<00:40,  2.52s/it][A
 44%|████▁     | 12/27 [00:30<00:37,  2.49s/it][A
 48%|████▊     | 13/27 [00:32<00:35,  2.57s/it][A
 52%|█████▁    | 14/27 [00:35<00:32,  2.53s/it][A
 56%|█████▌    | 15/27 [00:37<00:30,  2.51s/it][A
 59%|█████▉    | 16/27 [00:40<00:27,  2.47s/it][A
 63%|██████▎   | 17/27 [00:42<00:24,  2.45s/it][A
 67%|██████▋   | 18/27 [00:45<00:22,  2.51s/it][A
 70%|███████   | 19/27 [00:47<00:19,  2.47s/it][A
 74%|███████▁  | 20/27 [00:49<00:17,  2.45s/it][A
 78%|███████▊  | 21/27 [00:52<00:14,  2.47s/it][A
 81%|████████▁ | 22/27 [00:54<00:12,  2.47s/it][A
 85%|████████▌ | 23/27 [00:57<00:09,  2.49s/it][A
 89%|████████▉ | 24/27 [00:59<00:07,  2.50s/it][A
 93%|█████████▎| 25/27 [01:02<00:05,  2.51s/it][A
 96%|█████████▋| 26/27 [01:04<00:02,  2.47s/it][A
100%|██████████| 27/27 [01:07<00:00,  2.46s/it][A100%|██████████| 27/27 [01:07<00:00,  2.49s/it]
Experiment 2 Progress:  70%|███████   | 7/10 [35:16<08:40, 173.62s/it]✓ Complete - SVM F1: 0.4883, DT F1: 0.3955, RF F1: 0.4722

--------------------------------------------------------------------------------
Config 7/10: Window=170, Overlap=20
--------------------------------------------------------------------------------
[FILTER] Applying Low-pass Filter (cutoff=5Hz, order=4)
Generated 23757 samples, training models...

  0%|          | 0/27 [00:00<?, ?it/s][A
  4%|▎         | 1/27 [00:03<01:22,  3.18s/it][A
  7%|▋         | 2/27 [00:05<01:07,  2.70s/it][A
 11%|█         | 3/27 [00:07<01:01,  2.56s/it][A
 15%|█▁        | 4/27 [00:10<00:57,  2.49s/it][A
 19%|█▊        | 5/27 [00:12<00:53,  2.45s/it][A
 22%|██▁       | 6/27 [00:15<00:50,  2.42s/it][A
 26%|██▌       | 7/27 [00:17<00:49,  2.45s/it][A
 30%|██▉       | 8/27 [00:20<00:46,  2.46s/it][A
 33%|███▎      | 9/27 [00:22<00:43,  2.43s/it][A
 37%|███▋      | 10/27 [00:24<00:41,  2.42s/it][A
 41%|████      | 11/27 [00:27<00:40,  2.50s/it][A
 44%|████▁     | 12/27 [00:29<00:36,  2.47s/it][A
 48%|████▊     | 13/27 [00:32<00:35,  2.55s/it][A
 52%|█████▁    | 14/27 [00:35<00:32,  2.51s/it][A
 56%|█████▌    | 15/27 [00:37<00:29,  2.48s/it][A
 59%|█████▉    | 16/27 [00:39<00:26,  2.45s/it][A
 63%|██████▎   | 17/27 [00:42<00:24,  2.44s/it][A
 67%|██████▋   | 18/27 [00:44<00:22,  2.49s/it][A
 70%|███████   | 19/27 [00:47<00:19,  2.45s/it][A
 74%|███████▁  | 20/27 [00:49<00:17,  2.43s/it][A
 78%|███████▊  | 21/27 [00:52<00:14,  2.46s/it][A
 81%|████████▁ | 22/27 [00:54<00:12,  2.46s/it][A
 85%|████████▌ | 23/27 [00:57<00:09,  2.48s/it][A
 89%|████████▉ | 24/27 [00:59<00:07,  2.50s/it][A
 93%|█████████▎| 25/27 [01:02<00:05,  2.51s/it][A
 96%|█████████▋| 26/27 [01:04<00:02,  2.48s/it][A
100%|██████████| 27/27 [01:07<00:00,  2.45s/it][A100%|██████████| 27/27 [01:07<00:00,  2.48s/it]
Experiment 2 Progress:  80%|████████  | 8/10 [36:28<04:42, 141.33s/it]✓ Complete - SVM F1: 0.4883, DT F1: 0.3957, RF F1: 0.4722

--------------------------------------------------------------------------------
Config 9/10: Window=170, Overlap=30
--------------------------------------------------------------------------------
[FILTER] Applying Low-pass Filter (cutoff=5Hz, order=4)
Generated 15843 samples, training models...

  0%|          | 0/27 [00:00<?, ?it/s][A
  4%|▎         | 1/27 [00:01<00:40,  1.57s/it][A
  7%|▋         | 2/27 [00:02<00:35,  1.41s/it][A
 11%|█         | 3/27 [00:04<00:32,  1.36s/it][A
 15%|█▁        | 4/27 [00:05<00:30,  1.33s/it][A
 19%|█▊        | 5/27 [00:06<00:29,  1.32s/it][A
 22%|██▁       | 6/27 [00:08<00:27,  1.32s/it][A
 26%|██▌       | 7/27 [00:09<00:26,  1.33s/it][A
 30%|██▉       | 8/27 [00:10<00:25,  1.33s/it][A
 33%|███▎      | 9/27 [00:12<00:23,  1.33s/it][A
 37%|███▋      | 10/27 [00:13<00:22,  1.32s/it][A
 41%|████      | 11/27 [00:14<00:21,  1.36s/it][A
 44%|████▁     | 12/27 [00:16<00:20,  1.35s/it][A
 48%|████▊     | 13/27 [00:17<00:19,  1.38s/it][A
 52%|█████▁    | 14/27 [00:18<00:17,  1.36s/it][A
 56%|█████▌    | 15/27 [00:20<00:16,  1.35s/it][A
 59%|█████▉    | 16/27 [00:21<00:14,  1.34s/it][A
 63%|██████▎   | 17/27 [00:22<00:13,  1.32s/it][A
 67%|██████▋   | 18/27 [00:24<00:12,  1.34s/it][A
 70%|███████   | 19/27 [00:25<00:10,  1.33s/it][A
 74%|███████▁  | 20/27 [00:26<00:09,  1.31s/it][A
 78%|███████▊  | 21/27 [00:28<00:07,  1.33s/it][A
 81%|████████▁ | 22/27 [00:29<00:06,  1.33s/it][A
 85%|████████▌ | 23/27 [00:30<00:05,  1.35s/it][A
 89%|████████▉ | 24/27 [00:32<00:04,  1.35s/it][A
 93%|█████████▎| 25/27 [00:33<00:02,  1.36s/it][A
 96%|█████████▋| 26/27 [00:35<00:01,  1.37s/it][A
100%|██████████| 27/27 [00:36<00:00,  1.36s/it][A100%|██████████| 27/27 [00:36<00:00,  1.35s/it]
Experiment 2 Progress:  90%|█████████ | 9/10 [37:08<01:49, 109.63s/it]✓ Complete - SVM F1: 0.4854, DT F1: 0.3897, RF F1: 0.4704

--------------------------------------------------------------------------------
Config 9/10: Window=170, Overlap=30
--------------------------------------------------------------------------------
[FILTER] Applying Low-pass Filter (cutoff=5Hz, order=4)
Generated 15843 samples, training models...

  0%|          | 0/27 [00:00<?, ?it/s][A
  4%|▎         | 1/27 [00:01<00:41,  1.58s/it][A
  7%|▋         | 2/27 [00:02<00:35,  1.43s/it][A
 11%|█         | 3/27 [00:04<00:33,  1.39s/it][A
 15%|█▁        | 4/27 [00:05<00:31,  1.37s/it][A
 19%|█▊        | 5/27 [00:06<00:29,  1.35s/it][A
 22%|██▁       | 6/27 [00:08<00:28,  1.34s/it][A
 26%|██▌       | 7/27 [00:09<00:27,  1.35s/it][A
 30%|██▉       | 8/27 [00:10<00:25,  1.36s/it][A
 33%|███▎      | 9/27 [00:12<00:24,  1.34s/it][A
 37%|███▋      | 10/27 [00:13<00:22,  1.33s/it][A
 41%|████      | 11/27 [00:15<00:21,  1.37s/it][A
 44%|████▁     | 12/27 [00:16<00:20,  1.36s/it][A
 48%|████▊     | 13/27 [00:17<00:19,  1.39s/it][A
 52%|█████▁    | 14/27 [00:19<00:17,  1.37s/it][A
 56%|█████▌    | 15/27 [00:20<00:16,  1.35s/it][A
 59%|█████▉    | 16/27 [00:21<00:14,  1.34s/it][A
 63%|██████▎   | 17/27 [00:23<00:13,  1.33s/it][A
 67%|██████▋   | 18/27 [00:24<00:12,  1.35s/it][A
 70%|███████   | 19/27 [00:25<00:10,  1.34s/it][A
 74%|███████▁  | 20/27 [00:27<00:09,  1.32s/it][A
 78%|███████▊  | 21/27 [00:28<00:08,  1.34s/it][A
 81%|████████▁ | 22/27 [00:29<00:06,  1.35s/it][A
 85%|████████▌ | 23/27 [00:31<00:05,  1.35s/it][A
 89%|████████▉ | 24/27 [00:32<00:04,  1.37s/it][A
 93%|█████████▎| 25/27 [00:34<00:02,  1.38s/it][A
 96%|█████████▋| 26/27 [00:35<00:01,  1.37s/it][A
100%|██████████| 27/27 [00:36<00:00,  1.36s/it][A100%|██████████| 27/27 [00:36<00:00,  1.36s/it]
Experiment 2 Progress: 100%|██████████| 10/10 [37:49<00:00, 88.21s/it]Experiment 2 Progress: 100%|██████████| 10/10 [37:49<00:00, 226.90s/it]
/home/odin/achal/Pervasive-Computing-for-Health/tutorial_3/experiments.py:592: MatplotlibDeprecationWarning: The 'labels' parameter of boxplot() has been renamed 'tick_labels' since Matplotlib 3.9; support for the old name will be dropped in 3.11.
  bp = ax1.boxplot(data_to_plot, labels=models, patch_artist=True,
✓ Complete - SVM F1: 0.4854, DT F1: 0.3893, RF F1: 0.4704

================================================================================
Experiment 2 Complete - Tested 10 configurations
================================================================================

Results saved to: /home/odin/achal/Pervasive-Computing-for-Health/tutorial_3/results/run_20260205_163529/experiment2_overlap_sweep_20260205_163529.csv

================================================================================
GENERATING PLOTS
================================================================================
Model comparison plot saved: /home/odin/achal/Pervasive-Computing-for-Health/tutorial_3/results/run_20260205_163529/model_comparison_20260205_163529.png
Distribution plot saved: /home/odin/achal/Pervasive-Computing-for-Health/tutorial_3/results/run_20260205_163529/performance_distribution_20260205_163529.png

================================================================================
EXPERIMENT SUMMARY
================================================================================
 window_size  overlap  overlap_percent  num_samples   svm_f1    dt_f1    rf_f1
         170        5                2        94960 0.481121 0.379410 0.463844
         170        5                2        94960 0.481121 0.386474 0.463844
         170       10                5        47491 0.483549 0.378159 0.472209
         170       10                5        47491 0.483549 0.376044 0.472209
         170       15                8        31666 0.486050 0.383870 0.465257
         170       15                8        31666 0.486050 0.380660 0.465257
         170       20               11        23757 0.488326 0.395472 0.472218
         170       20               11        23757 0.488326 0.395739 0.472218
         170       30               17        15843 0.485403 0.389671 0.470353
         170       30               17        15843 0.485403 0.389263 0.470353

✓ Best Configuration:
  Window: 170
  Overlap: 20
  SVM F1: 0.4883
  RF F1: 0.4722
  DT F1: 0.3955

================================================================================
EXPERIMENT COMPLETE - 2026-02-05 17:13:22
Results saved to: /home/odin/achal/Pervasive-Computing-for-Health/tutorial_3/results/run_20260205_163529
================================================================================
