[INIT] BLAS threading configured to use 32 cores
[INIT] This will accelerate SVM's numerical operations
[INIT] threadpoolctl available - BLAS threading will be controlled at runtime

================================================================================
FILTER COMPARISON EXPERIMENT
================================================================================
Configuration: Window=170, Overlap=85
Experiments: (1) No Filter, (2) Lowpass 5Hz
Run ID: 20260205_154535
================================================================================

CPU Threading Status:
  OMP_NUM_THREADS: 32
  MKL_NUM_THREADS: 32
  OPENBLAS_NUM_THREADS: 32
  Available cores: 32
  Status: ✓ Multi-threading ENABLED for SVM/numpy operations

Loading dataset...
Loading dataset:   0%|          | 0/1 [00:00<?, ?it/s]Loading dataset: 100%|██████████| 1/1 [00:00<00:00, 31300.78it/s]
Loading dataset:   0%|          | 0/21 [00:00<?, ?it/s]Loading dataset:  14%|█▍        | 3/21 [00:00<00:00, 23.19it/s]Loading dataset:  29%|██▊       | 6/21 [00:00<00:00, 19.65it/s]Loading dataset:  38%|███▊      | 8/21 [00:00<00:00, 15.98it/s]Loading dataset:  57%|█████▋    | 12/21 [00:00<00:00, 14.74it/s]Loading dataset:  71%|███████▏  | 15/21 [00:00<00:00, 16.32it/s]Loading dataset:  81%|████████  | 17/21 [00:01<00:00, 11.68it/s]Loading dataset:  90%|█████████ | 19/21 [00:01<00:00,  6.69it/s]Loading dataset: 100%|██████████| 21/21 [00:02<00:00,  7.38it/s]Loading dataset: 100%|██████████| 21/21 [00:02<00:00, 10.13it/s]
Loading dataset: 0it [00:00, ?it/s]Loading dataset: 0it [00:00, ?it/s]
Loading dataset: 0it [00:00, ?it/s]Loading dataset: 0it [00:00, ?it/s]
Loading dataset: 0it [00:00, ?it/s]Loading dataset: 0it [00:00, ?it/s]
Loading dataset: 0it [00:00, ?it/s]Loading dataset: 0it [00:00, ?it/s]
Loading dataset: 0it [00:00, ?it/s]Loading dataset: 0it [00:00, ?it/s]
Loading dataset: 0it [00:00, ?it/s]Loading dataset: 0it [00:00, ?it/s]
Loading dataset: 0it [00:00, ?it/s]Loading dataset: 0it [00:00, ?it/s]
Loading dataset: 0it [00:00, ?it/s]Loading dataset: 0it [00:00, ?it/s]
Loading dataset: 0it [00:00, ?it/s]Loading dataset: 0it [00:00, ?it/s]
Loading dataset: 0it [00:00, ?it/s]Loading dataset: 0it [00:00, ?it/s]
Loading dataset: 0it [00:00, ?it/s]Loading dataset: 0it [00:00, ?it/s]
Loading dataset: 0it [00:00, ?it/s]Loading dataset: 0it [00:00, ?it/s]
Loading dataset: 0it [00:00, ?it/s]Loading dataset: 0it [00:00, ?it/s]
Loading dataset: 0it [00:00, ?it/s]Loading dataset: 0it [00:00, ?it/s]
Loading dataset: 0it [00:00, ?it/s]Loading dataset: 0it [00:00, ?it/s]
Loading dataset: 0it [00:00, ?it/s]Loading dataset: 0it [00:00, ?it/s]
Loading dataset: 0it [00:00, ?it/s]Loading dataset: 0it [00:00, ?it/s]
Loading dataset: 0it [00:00, ?it/s]Loading dataset: 0it [00:00, ?it/s]
Loading dataset: 0it [00:00, ?it/s]Loading dataset: 0it [00:00, ?it/s]
Loading dataset: 0it [00:00, ?it/s]Loading dataset: 0it [00:00, ?it/s]
Loading dataset: 0it [00:00, ?it/s]Loading dataset: 0it [00:00, ?it/s]
Dataset loaded: 479289 samples, 27 volunteers

================================================================================
EXPERIMENT 1/2: No Filter
================================================================================
Window=170, Overlap=85, Step=85

Preparing windowed data...
Processing users:   0%|          | 0/27 [00:00<?, ?it/s]Processing users:   4%|▎         | 1/27 [00:00<00:14,  1.78it/s]Processing users:   7%|▋         | 2/27 [00:00<00:07,  3.22it/s]Processing users:  15%|█▍        | 4/27 [00:00<00:04,  5.68it/s]Processing users:  22%|██▏       | 6/27 [00:01<00:02,  8.34it/s]Processing users:  30%|██▉       | 8/27 [00:01<00:01, 10.89it/s]Processing users:  41%|████      | 11/27 [00:01<00:01, 14.48it/s]Processing users:  81%|████████▏ | 22/27 [00:01<00:00, 37.48it/s]Processing users: 100%|██████████| 27/27 [00:01<00:00, 19.40it/s]
Generated 5604 samples from 27 volunteers
Feature shape: (5604, 18)

Training models (Leave-One-Group-Out CV)...
  0%|          | 0/27 [00:00<?, ?it/s]  4%|▎         | 1/27 [00:00<00:07,  3.38it/s]  7%|▋         | 2/27 [00:00<00:07,  3.51it/s] 11%|█         | 3/27 [00:00<00:06,  3.51it/s] 15%|█▍        | 4/27 [00:01<00:06,  3.55it/s] 19%|█▊        | 5/27 [00:01<00:06,  3.54it/s] 22%|██▏       | 6/27 [00:01<00:05,  3.56it/s] 26%|██▌       | 7/27 [00:01<00:05,  3.56it/s] 30%|██▉       | 8/27 [00:02<00:05,  3.55it/s] 33%|███▎      | 9/27 [00:02<00:05,  3.53it/s] 37%|███▋      | 10/27 [00:02<00:04,  3.53it/s] 41%|████      | 11/27 [00:03<00:04,  3.48it/s] 44%|████▍     | 12/27 [00:03<00:04,  3.51it/s] 48%|████▊     | 13/27 [00:03<00:04,  3.46it/s] 52%|█████▏    | 14/27 [00:03<00:03,  3.46it/s] 56%|█████▌    | 15/27 [00:04<00:03,  3.50it/s] 59%|█████▉    | 16/27 [00:04<00:03,  3.51it/s] 63%|██████▎   | 17/27 [00:04<00:02,  3.50it/s] 67%|██████▋   | 18/27 [00:05<00:02,  3.47it/s] 70%|███████   | 19/27 [00:05<00:02,  3.51it/s] 74%|███████▍  | 20/27 [00:05<00:01,  3.54it/s] 78%|███████▊  | 21/27 [00:05<00:01,  3.53it/s] 81%|████████▏ | 22/27 [00:06<00:01,  3.53it/s] 85%|████████▌ | 23/27 [00:06<00:01,  3.52it/s] 89%|████████▉ | 24/27 [00:06<00:00,  3.51it/s] 93%|█████████▎| 25/27 [00:07<00:00,  3.49it/s] 96%|█████████▋| 26/27 [00:07<00:00,  3.38it/s]100%|██████████| 27/27 [00:07<00:00,  3.41it/s]100%|██████████| 27/27 [00:07<00:00,  3.49it/s]

✓ Experiment 1 Complete:
  SVM F1: 0.4464
  RF  F1: 0.4485
  DT  F1: 0.3732

================================================================================
EXPERIMENT 2/2: Lowpass 5Hz
================================================================================
Window=170, Overlap=85, Step=85

Preparing windowed data...
Applying sensor filtering...
[FILTER] Applying Low-pass Filter (cutoff=5Hz, order=4)
Processing users:   0%|          | 0/27 [00:00<?, ?it/s]Processing users:   4%|▎         | 1/27 [00:00<00:14,  1.80it/s]Processing users:   7%|▋         | 2/27 [00:00<00:07,  3.25it/s]Processing users:  15%|█▍        | 4/27 [00:00<00:04,  5.75it/s]Processing users:  22%|██▏       | 6/27 [00:00<00:02,  8.43it/s]Processing users:  33%|███▎      | 9/27 [00:01<00:01, 12.06it/s]Processing users:  44%|████▍     | 12/27 [00:01<00:00, 16.02it/s]Processing users:  93%|█████████▎| 25/27 [00:01<00:00, 41.99it/s]Processing users: 100%|██████████| 27/27 [00:01<00:00, 19.58it/s]
Generated 5604 samples from 27 volunteers
Feature shape: (5604, 18)

Training models (Leave-One-Group-Out CV)...
  0%|          | 0/27 [00:00<?, ?it/s]  4%|▎         | 1/27 [00:00<00:08,  3.15it/s]  7%|▋         | 2/27 [00:00<00:08,  3.10it/s] 11%|█         | 3/27 [00:00<00:07,  3.08it/s] 15%|█▍        | 4/27 [00:01<00:07,  3.07it/s] 19%|█▊        | 5/27 [00:01<00:07,  3.03it/s] 22%|██▏       | 6/27 [00:01<00:06,  3.04it/s] 26%|██▌       | 7/27 [00:02<00:06,  3.00it/s] 30%|██▉       | 8/27 [00:02<00:06,  2.99it/s] 33%|███▎      | 9/27 [00:02<00:05,  3.01it/s] 37%|███▋      | 10/27 [00:03<00:05,  3.02it/s] 41%|████      | 11/27 [00:03<00:05,  2.98it/s] 44%|████▍     | 12/27 [00:03<00:04,  3.01it/s] 48%|████▊     | 13/27 [00:04<00:04,  3.01it/s] 52%|█████▏    | 14/27 [00:04<00:04,  3.01it/s] 56%|█████▌    | 15/27 [00:04<00:03,  3.02it/s] 59%|█████▉    | 16/27 [00:05<00:03,  3.03it/s] 63%|██████▎   | 17/27 [00:05<00:03,  3.05it/s] 67%|██████▋   | 18/27 [00:05<00:02,  3.01it/s] 70%|███████   | 19/27 [00:06<00:02,  3.02it/s] 74%|███████▍  | 20/27 [00:06<00:02,  3.03it/s] 78%|███████▊  | 21/27 [00:06<00:01,  3.02it/s] 81%|████████▏ | 22/27 [00:07<00:01,  3.01it/s] 85%|████████▌ | 23/27 [00:07<00:01,  3.00it/s] 89%|████████▉ | 24/27 [00:07<00:01,  2.87it/s] 93%|█████████▎| 25/27 [00:08<00:00,  2.90it/s] 96%|█████████▋| 26/27 [00:08<00:00,  2.94it/s]100%|██████████| 27/27 [00:08<00:00,  2.98it/s]100%|██████████| 27/27 [00:08<00:00,  3.00it/s]

✓ Experiment 2 Complete:
  SVM F1: 0.4622
  RF  F1: 0.4697
  DT  F1: 0.4009

================================================================================
COMPARISON SUMMARY
================================================================================
experiment_name  window_size  overlap  step_size  num_samples   svm_f1    rf_f1    dt_f1
      No Filter          170       85         85         5604 0.446383 0.448482 0.373197
    Lowpass 5Hz          170       85         85         5604 0.462239 0.469665 0.400931

================================================================================
FILTER IMPACT ANALYSIS
================================================================================

Baseline (No Filter):
  SVM: 0.4464
  RF:  0.4485
  DT:  0.3732

Filtered (Lowpass 5Hz):
  SVM: 0.4622 (+1.59%)
  RF:  0.4697 (+2.12%)
  DT:  0.4009 (+2.77%)

✓ Results saved: /home/odin/achal/Pervasive-Computing-for-Health/tutorial_3/results/comparison_20260205_154535/comparison_results_20260205_154535.csv

================================================================================
GENERATING PLOTS
================================================================================

✓ Comparison plot saved: /home/odin/achal/Pervasive-Computing-for-Health/tutorial_3/results/comparison_20260205_154535/filter_vs_nofilter_comparison_20260205_154535.png

Generating confusion matrices for Lowpass 5Hz...
✓ Confusion matrix saved: /home/odin/achal/Pervasive-Computing-for-Health/tutorial_3/results/comparison_20260205_154535/confusion_matrix_SVM_Lowpass5Hz_20260205_154535.png
✓ Confusion matrix saved: /home/odin/achal/Pervasive-Computing-for-Health/tutorial_3/results/comparison_20260205_154535/confusion_matrix_RF_Lowpass5Hz_20260205_154535.png

================================================================================
EXPERIMENT COMPLETE
================================================================================
All results saved to: /home/odin/achal/Pervasive-Computing-for-Health/tutorial_3/results/comparison_20260205_154535
================================================================================
