[INIT] BLAS threading configured to use 32 cores
[INIT] This will accelerate SVM's numerical operations
[INIT] threadpoolctl available - BLAS threading will be controlled at runtime

================================================================================
FILTER COMPARISON EXPERIMENT
================================================================================
Configuration: Window=170, Overlap=10
Experiments: (1) No Filter, (2) Lowpass 5Hz
Run ID: 20260205_155850
================================================================================

CPU Threading Status:
  OMP_NUM_THREADS: 32
  MKL_NUM_THREADS: 32
  OPENBLAS_NUM_THREADS: 32
  Available cores: 32
  Status: ✓ Multi-threading ENABLED for SVM/numpy operations

Loading dataset...
Loading dataset:   0%|          | 0/1 [00:00<?, ?it/s]Loading dataset: 100%|██████████| 1/1 [00:00<00:00, 32017.59it/s]
Loading dataset:   0%|          | 0/21 [00:00<?, ?it/s]Loading dataset:  14%|█▍        | 3/21 [00:00<00:00, 23.60it/s]Loading dataset:  29%|██▊       | 6/21 [00:00<00:00, 20.10it/s]Loading dataset:  43%|████▎     | 9/21 [00:00<00:00, 17.68it/s]Loading dataset:  57%|█████▋    | 12/21 [00:00<00:00, 13.70it/s]Loading dataset:  71%|███████▏  | 15/21 [00:00<00:00, 15.72it/s]Loading dataset:  81%|████████  | 17/21 [00:01<00:00, 10.92it/s]Loading dataset:  90%|█████████ | 19/21 [00:01<00:00,  6.88it/s]Loading dataset: 100%|██████████| 21/21 [00:02<00:00,  7.57it/s]Loading dataset: 100%|██████████| 21/21 [00:02<00:00, 10.26it/s]
Loading dataset: 0it [00:00, ?it/s]Loading dataset: 0it [00:00, ?it/s]
Loading dataset: 0it [00:00, ?it/s]Loading dataset: 0it [00:00, ?it/s]
Loading dataset: 0it [00:00, ?it/s]Loading dataset: 0it [00:00, ?it/s]
Loading dataset: 0it [00:00, ?it/s]Loading dataset: 0it [00:00, ?it/s]
Loading dataset: 0it [00:00, ?it/s]Loading dataset: 0it [00:00, ?it/s]
Loading dataset: 0it [00:00, ?it/s]Loading dataset: 0it [00:00, ?it/s]
Loading dataset: 0it [00:00, ?it/s]Loading dataset: 0it [00:00, ?it/s]
Loading dataset: 0it [00:00, ?it/s]Loading dataset: 0it [00:00, ?it/s]
Loading dataset: 0it [00:00, ?it/s]Loading dataset: 0it [00:00, ?it/s]
Loading dataset: 0it [00:00, ?it/s]Loading dataset: 0it [00:00, ?it/s]
Loading dataset: 0it [00:00, ?it/s]Loading dataset: 0it [00:00, ?it/s]
Loading dataset: 0it [00:00, ?it/s]Loading dataset: 0it [00:00, ?it/s]
Loading dataset: 0it [00:00, ?it/s]Loading dataset: 0it [00:00, ?it/s]
Loading dataset: 0it [00:00, ?it/s]Loading dataset: 0it [00:00, ?it/s]
Loading dataset: 0it [00:00, ?it/s]Loading dataset: 0it [00:00, ?it/s]
Loading dataset: 0it [00:00, ?it/s]Loading dataset: 0it [00:00, ?it/s]
Loading dataset: 0it [00:00, ?it/s]Loading dataset: 0it [00:00, ?it/s]
Loading dataset: 0it [00:00, ?it/s]Loading dataset: 0it [00:00, ?it/s]
Loading dataset: 0it [00:00, ?it/s]Loading dataset: 0it [00:00, ?it/s]
Loading dataset: 0it [00:00, ?it/s]Loading dataset: 0it [00:00, ?it/s]
Loading dataset: 0it [00:00, ?it/s]Loading dataset: 0it [00:00, ?it/s]
Dataset loaded: 479289 samples, 27 volunteers

================================================================================
EXPERIMENT 1/2: No Filter
================================================================================
Window=170, Overlap=10, Step=160

Preparing windowed data...
Processing users:   0%|          | 0/27 [00:00<?, ?it/s]Processing users:   4%|▎         | 1/27 [00:04<01:58,  4.54s/it]Processing users:   7%|▋         | 2/27 [00:05<01:02,  2.49s/it]Processing users:  11%|█         | 3/27 [00:06<00:39,  1.65s/it]Processing users:  15%|█▍        | 4/27 [00:07<00:30,  1.32s/it]Processing users:  19%|█▊        | 5/27 [00:07<00:21,  1.02it/s]Processing users:  22%|██▏       | 6/27 [00:07<00:16,  1.26it/s]Processing users:  26%|██▌       | 7/27 [00:08<00:12,  1.54it/s]Processing users:  30%|██▉       | 8/27 [00:08<00:10,  1.80it/s]Processing users:  33%|███▎      | 9/27 [00:08<00:08,  2.10it/s]Processing users:  37%|███▋      | 10/27 [00:09<00:07,  2.38it/s]Processing users:  41%|████      | 11/27 [00:09<00:06,  2.64it/s]Processing users:  48%|████▊     | 13/27 [00:09<00:03,  4.13it/s]Processing users:  93%|█████████▎| 25/27 [00:09<00:00, 16.82it/s]Processing users: 100%|██████████| 27/27 [00:09<00:00,  2.73it/s]
Generated 47491 samples from 27 volunteers
Feature shape: (47491, 18)

Training models (Leave-One-Group-Out CV)...
  0%|          | 0/27 [00:00<?, ?it/s]  4%|▎         | 1/27 [00:10<04:41, 10.82s/it]  7%|▋         | 2/27 [00:17<03:36,  8.64s/it] 11%|█         | 3/27 [00:25<03:10,  7.93s/it] 15%|█▍        | 4/27 [00:32<02:55,  7.61s/it] 19%|█▊        | 5/27 [00:39<02:43,  7.44s/it] 22%|██▏       | 6/27 [00:46<02:34,  7.35s/it] 26%|██▌       | 7/27 [00:54<02:28,  7.44s/it] 30%|██▉       | 8/27 [01:01<02:22,  7.50s/it] 33%|███▎      | 9/27 [01:08<02:12,  7.33s/it] 37%|███▋      | 10/27 [01:15<02:02,  7.22s/it] 41%|████      | 11/27 [01:24<02:01,  7.59s/it] 44%|████▍     | 12/27 [01:31<01:51,  7.43s/it] 48%|████▊     | 13/27 [01:40<01:50,  7.88s/it] 52%|█████▏    | 14/27 [01:47<01:39,  7.67s/it] 56%|█████▌    | 15/27 [01:54<01:29,  7.49s/it] 59%|█████▉    | 16/27 [02:01<01:21,  7.40s/it] 63%|██████▎   | 17/27 [02:08<01:13,  7.33s/it] 67%|██████▋   | 18/27 [02:16<01:07,  7.54s/it] 70%|███████   | 19/27 [02:23<00:59,  7.42s/it] 74%|███████▍  | 20/27 [02:30<00:51,  7.33s/it] 78%|███████▊  | 21/27 [02:38<00:44,  7.45s/it] 81%|████████▏ | 22/27 [02:46<00:37,  7.49s/it] 85%|████████▌ | 23/27 [02:54<00:30,  7.59s/it] 89%|████████▉ | 24/27 [03:01<00:22,  7.57s/it] 93%|█████████▎| 25/27 [03:09<00:15,  7.55s/it] 96%|█████████▋| 26/27 [03:16<00:07,  7.37s/it]100%|██████████| 27/27 [03:23<00:00,  7.29s/it]100%|██████████| 27/27 [03:23<00:00,  7.52s/it]

✓ Experiment 1 Complete:
  SVM F1: 0.4787
  RF  F1: 0.4553
  DT  F1: 0.3904

================================================================================
EXPERIMENT 2/2: Lowpass 5Hz
================================================================================
Window=170, Overlap=10, Step=160

Preparing windowed data...
Applying sensor filtering...
[FILTER] Applying Low-pass Filter (cutoff=5Hz, order=4)
Processing users:   0%|          | 0/27 [00:00<?, ?it/s]Processing users:   4%|▎         | 1/27 [00:04<01:59,  4.58s/it]Processing users:   7%|▋         | 2/27 [00:05<01:02,  2.51s/it]Processing users:  11%|█         | 3/27 [00:06<00:39,  1.67s/it]Processing users:  15%|█▍        | 4/27 [00:07<00:30,  1.34s/it]Processing users:  19%|█▊        | 5/27 [00:07<00:22,  1.00s/it]Processing users:  22%|██▏       | 6/27 [00:07<00:16,  1.24it/s]Processing users:  26%|██▌       | 7/27 [00:08<00:13,  1.52it/s]Processing users:  30%|██▉       | 8/27 [00:08<00:10,  1.77it/s]Processing users:  33%|███▎      | 9/27 [00:08<00:08,  2.07it/s]Processing users:  37%|███▋      | 10/27 [00:09<00:07,  2.35it/s]Processing users:  41%|████      | 11/27 [00:09<00:06,  2.62it/s]Processing users:  48%|████▊     | 13/27 [00:09<00:03,  4.09it/s]Processing users:  93%|█████████▎| 25/27 [00:09<00:00, 16.65it/s]Processing users: 100%|██████████| 27/27 [00:10<00:00,  2.69it/s]
Generated 47491 samples from 27 volunteers
Feature shape: (47491, 18)

Training models (Leave-One-Group-Out CV)...
  0%|          | 0/27 [00:00<?, ?it/s]  4%|▎         | 1/27 [00:10<04:32, 10.49s/it]  7%|▋         | 2/27 [00:17<03:34,  8.58s/it] 11%|█         | 3/27 [00:25<03:12,  8.00s/it] 15%|█▍        | 4/27 [00:32<02:57,  7.70s/it] 19%|█▊        | 5/27 [00:39<02:45,  7.53s/it] 22%|██▏       | 6/27 [00:46<02:35,  7.41s/it] 26%|██▌       | 7/27 [00:54<02:29,  7.50s/it] 30%|██▉       | 8/27 [01:01<02:23,  7.53s/it] 33%|███▎      | 9/27 [01:09<02:13,  7.42s/it] 37%|███▋      | 10/27 [01:16<02:05,  7.36s/it] 41%|████      | 11/27 [01:24<02:03,  7.70s/it] 44%|████▍     | 12/27 [01:32<01:53,  7.58s/it] 48%|████▊     | 13/27 [01:40<01:50,  7.93s/it] 52%|█████▏    | 14/27 [01:48<01:40,  7.75s/it] 56%|█████▌    | 15/27 [01:55<01:31,  7.64s/it] 59%|█████▉    | 16/27 [02:02<01:22,  7.54s/it] 63%|██████▎   | 17/27 [02:10<01:14,  7.47s/it] 67%|██████▋   | 18/27 [02:18<01:09,  7.69s/it] 70%|███████   | 19/27 [02:25<01:00,  7.56s/it] 74%|███████▍  | 20/27 [02:32<00:52,  7.47s/it] 78%|███████▊  | 21/27 [02:40<00:45,  7.59s/it] 81%|████████▏ | 22/27 [02:48<00:38,  7.61s/it] 85%|████████▌ | 23/27 [02:56<00:30,  7.72s/it] 89%|████████▉ | 24/27 [03:04<00:23,  7.72s/it] 93%|█████████▎| 25/27 [03:11<00:15,  7.70s/it] 96%|█████████▋| 26/27 [03:19<00:07,  7.57s/it]100%|██████████| 27/27 [03:26<00:00,  7.53s/it]100%|██████████| 27/27 [03:26<00:00,  7.65s/it]

✓ Experiment 2 Complete:
  SVM F1: 0.4835
  RF  F1: 0.4722
  DT  F1: 0.3849

================================================================================
COMPARISON SUMMARY
================================================================================
experiment_name  window_size  overlap  step_size  num_samples   svm_f1    rf_f1    dt_f1
      No Filter          170       10        160        47491 0.478685 0.455292 0.390376
    Lowpass 5Hz          170       10        160        47491 0.483549 0.472209 0.384875

================================================================================
FILTER IMPACT ANALYSIS
================================================================================

Baseline (No Filter):
  SVM: 0.4787
  RF:  0.4553
  DT:  0.3904

Filtered (Lowpass 5Hz):
  SVM: 0.4835 (+0.49%)
  RF:  0.4722 (+1.69%)
  DT:  0.3849 (-0.55%)

✓ Results saved: /home/odin/achal/Pervasive-Computing-for-Health/tutorial_3/results/comparison_20260205_155850/comparison_results_20260205_155850.csv

================================================================================
GENERATING PLOTS
================================================================================

✓ Comparison plot saved: /home/odin/achal/Pervasive-Computing-for-Health/tutorial_3/results/comparison_20260205_155850/filter_vs_nofilter_comparison_20260205_155850.png

Generating confusion matrices for Lowpass 5Hz...
✓ Confusion matrix saved: /home/odin/achal/Pervasive-Computing-for-Health/tutorial_3/results/comparison_20260205_155850/confusion_matrix_SVM_Lowpass5Hz_20260205_155850.png
✓ Confusion matrix saved: /home/odin/achal/Pervasive-Computing-for-Health/tutorial_3/results/comparison_20260205_155850/confusion_matrix_RF_Lowpass5Hz_20260205_155850.png

================================================================================
EXPERIMENT COMPLETE
================================================================================
All results saved to: /home/odin/achal/Pervasive-Computing-for-Health/tutorial_3/results/comparison_20260205_155850
================================================================================
