[INIT] Forced BLAS library to use 32 threads (set env vars)
[INIT] BLAS threading configured to use 32 cores
[INIT] This will accelerate SVM's numerical operations
[INIT] threadpoolctl available - BLAS threading will be controlled at runtime

================================================================================
ACTIVITY RECOGNITION WINDOWING PARAMETER OPTIMIZATION
================================================================================
Start: 2026-02-05 17:32:21
Run ID: 20260205_173221
================================================================================

Configuring CPU threading...

CPU Threading Status:
  OMP_NUM_THREADS: 32
  MKL_NUM_THREADS: 32
  OPENBLAS_NUM_THREADS: 32
  Available cores: 32
  Status: ✓ Multi-threading ENABLED for SVM/numpy operations

CPU Information:
  Physical cores: 16
  Logical cores (threads): 32
  Current usage: 0.2%
  Available memory: 84.72 GB
  Total memory: 91.94 GB

================================================================================
LOADING DATASET
================================================================================
Zip file: /home/odin/achal/Pervasive-Computing-for-Health/tutorial_3/adl_dataset
Extract to: /home/odin/achal/Pervasive-Computing-for-Health/tutorial_3/adl_dataset_extracted
Sampling frequency: 32 Hz

[INFO] Dataset already extracted, skipping extraction...
Loading dataset:   0%|          | 0/1 [00:00<?, ?it/s]Loading dataset: 100%|██████████| 1/1 [00:00<00:00, 31068.92it/s]
Loading dataset:   0%|          | 0/21 [00:00<?, ?it/s]Loading dataset:  14%|█▁        | 3/21 [00:00<00:00, 23.43it/s]Loading dataset:  29%|██▊       | 6/21 [00:00<00:00, 19.86it/s]Loading dataset:  43%|████▎     | 9/21 [00:00<00:00, 17.24it/s]Loading dataset:  57%|█████▋    | 12/21 [00:00<00:00, 14.04it/s]Loading dataset:  67%|██████▋   | 14/21 [00:00<00:00, 15.17it/s]Loading dataset:  76%|███████▌  | 16/21 [00:01<00:00,  9.44it/s]Loading dataset:  86%|████████▌ | 18/21 [00:01<00:00,  8.05it/s]Loading dataset:  95%|█████████▌| 20/21 [00:02<00:00,  6.63it/s]Loading dataset: 100%|██████████| 21/21 [00:02<00:00,  9.85it/s]
Loading dataset: 0it [00:00, ?it/s]Loading dataset: 0it [00:00, ?it/s]
Loading dataset: 0it [00:00, ?it/s]Loading dataset: 0it [00:00, ?it/s]
Loading dataset: 0it [00:00, ?it/s]Loading dataset: 0it [00:00, ?it/s]
Loading dataset: 0it [00:00, ?it/s]Loading dataset: 0it [00:00, ?it/s]
Loading dataset: 0it [00:00, ?it/s]Loading dataset: 0it [00:00, ?it/s]
Loading dataset: 0it [00:00, ?it/s]Loading dataset: 0it [00:00, ?it/s]
Loading dataset: 0it [00:00, ?it/s]Loading dataset: 0it [00:00, ?it/s]
Loading dataset: 0it [00:00, ?it/s]Loading dataset: 0it [00:00, ?it/s]
Loading dataset: 0it [00:00, ?it/s]Loading dataset: 0it [00:00, ?it/s]
Loading dataset: 0it [00:00, ?it/s]Loading dataset: 0it [00:00, ?it/s]
Loading dataset: 0it [00:00, ?it/s]Loading dataset: 0it [00:00, ?it/s]
Loading dataset: 0it [00:00, ?it/s]Loading dataset: 0it [00:00, ?it/s]
Loading dataset: 0it [00:00, ?it/s]Loading dataset: 0it [00:00, ?it/s]
Loading dataset: 0it [00:00, ?it/s]Loading dataset: 0it [00:00, ?it/s]
Loading dataset: 0it [00:00, ?it/s]Loading dataset: 0it [00:00, ?it/s]
Loading dataset: 0it [00:00, ?it/s]Loading dataset: 0it [00:00, ?it/s]
Loading dataset: 0it [00:00, ?it/s]Loading dataset: 0it [00:00, ?it/s]
Loading dataset: 0it [00:00, ?it/s]Loading dataset: 0it [00:00, ?it/s]
Loading dataset: 0it [00:00, ?it/s]Loading dataset: 0it [00:00, ?it/s]
Loading dataset: 0it [00:00, ?it/s]Loading dataset: 0it [00:00, ?it/s]
Loading dataset: 0it [00:00, ?it/s]Loading dataset: 0it [00:00, ?it/s]

Dataset loaded: 479289 samples, 9 columns
Activities: ['brush_teeth' 'pour_water' 'climb_stairs' 'getup_bed' 'comb_hair' 'walk'
 'sitdown_chair' 'standup_chair' 'drink_glass' 'eat_meat' 'liedown_bed'
 'use_telephone' 'eat_soup' 'descend_stairs']
Volunteers: 27

================================================================================
EXPERIMENT 2: Overlap Sweep
================================================================================
Fixed window size: 170
Overlaps to test: [15, 16, 17, 18, 19, 20, 21, 22, 25, 30, 35, 40, 50, 70]
Filter: lowpass
Total configurations: 14
================================================================================
Experiment 2 Progress:   0%|          | 0/14 [00:00<?, ?it/s]
--------------------------------------------------------------------------------
Config 1/14: Window=170, Overlap=15
--------------------------------------------------------------------------------
[FILTER] Applying Low-pass Filter (cutoff=5Hz, order=4)
Generated 31666 samples, training models...

  0%|          | 0/27 [00:00<?, ?it/s][A
  4%|▎         | 1/27 [00:05<02:14,  5.17s/it][A
  7%|▋         | 2/27 [00:08<01:48,  4.33s/it][A
 11%|█         | 3/27 [00:12<01:37,  4.05s/it][A
 15%|█▁        | 4/27 [00:16<01:30,  3.94s/it][A
 19%|█▊        | 5/27 [00:20<01:25,  3.88s/it][A
 22%|██▁       | 6/27 [00:23<01:20,  3.83s/it][A
 26%|██▌       | 7/27 [00:27<01:17,  3.88s/it][A
 30%|██▉       | 8/27 [00:31<01:13,  3.89s/it][A
 33%|███▎      | 9/27 [00:35<01:09,  3.84s/it][A
 37%|███▋      | 10/27 [00:39<01:04,  3.80s/it][A
 41%|████      | 11/27 [00:43<01:03,  3.96s/it][A
 44%|████▁     | 12/27 [00:47<00:58,  3.91s/it][A
 48%|████▊     | 13/27 [00:51<00:56,  4.07s/it][A
 52%|█████▁    | 14/27 [00:55<00:51,  3.97s/it][A
 56%|█████▌    | 15/27 [00:59<00:47,  3.92s/it][A
 59%|█████▉    | 16/27 [01:03<00:42,  3.86s/it][A
 63%|██████▎   | 17/27 [01:06<00:38,  3.82s/it][A
 67%|██████▋   | 18/27 [01:10<00:35,  3.92s/it][A
 70%|███████   | 19/27 [01:14<00:30,  3.87s/it][A
 74%|███████▁  | 20/27 [01:18<00:26,  3.83s/it][A
 78%|███████▊  | 21/27 [01:22<00:23,  3.88s/it][A
 81%|████████▁ | 22/27 [01:26<00:19,  3.90s/it][A
 85%|████████▌ | 23/27 [01:30<00:15,  3.93s/it][A
 89%|████████▉ | 24/27 [01:34<00:11,  3.95s/it][A
 93%|█████████▎| 25/27 [01:38<00:07,  3.95s/it][A
 96%|█████████▋| 26/27 [01:42<00:03,  3.90s/it][A
100%|██████████| 27/27 [01:45<00:00,  3.86s/it][A100%|██████████| 27/27 [01:45<00:00,  3.92s/it]
Experiment 2 Progress:   7%|▋         | 1/14 [01:52<24:25, 112.70s/it]✓ Complete - SVM F1: 0.4861, DT F1: 0.3794, RF F1: 0.4653

--------------------------------------------------------------------------------
Config 2/14: Window=170, Overlap=16
--------------------------------------------------------------------------------
[FILTER] Applying Low-pass Filter (cutoff=5Hz, order=4)
Generated 29688 samples, training models...

  0%|          | 0/27 [00:00<?, ?it/s][A
  4%|▎         | 1/27 [00:04<01:59,  4.60s/it][A
  7%|▋         | 2/27 [00:07<01:37,  3.88s/it][A
 11%|█         | 3/27 [00:11<01:27,  3.64s/it][A
 15%|█▁        | 4/27 [00:14<01:21,  3.54s/it][A
 19%|█▊        | 5/27 [00:18<01:16,  3.47s/it][A
 22%|██▁       | 6/27 [00:21<01:12,  3.44s/it][A
 26%|██▌       | 7/27 [00:25<01:09,  3.49s/it][A
 30%|██▉       | 8/27 [00:28<01:06,  3.51s/it][A
 33%|███▎      | 9/27 [00:31<01:02,  3.46s/it][A
 37%|███▋      | 10/27 [00:35<00:58,  3.43s/it][A
 41%|████      | 11/27 [00:39<00:57,  3.57s/it][A
 44%|████▁     | 12/27 [00:42<00:53,  3.53s/it][A
 48%|████▊     | 13/27 [00:46<00:51,  3.70s/it][A
 52%|█████▁    | 14/27 [00:50<00:47,  3.62s/it][A
 56%|█████▌    | 15/27 [00:53<00:42,  3.56s/it][A
 59%|█████▉    | 16/27 [00:56<00:38,  3.51s/it][A
 63%|██████▎   | 17/27 [01:00<00:34,  3.47s/it][A
 67%|██████▋   | 18/27 [01:04<00:31,  3.55s/it][A
 70%|███████   | 19/27 [01:07<00:27,  3.49s/it][A
 74%|███████▁  | 20/27 [01:10<00:24,  3.46s/it][A
 78%|███████▊  | 21/27 [01:14<00:21,  3.51s/it][A
 81%|████████▁ | 22/27 [01:18<00:17,  3.54s/it][A
 85%|████████▌ | 23/27 [01:21<00:14,  3.56s/it][A
 89%|████████▉ | 24/27 [01:25<00:10,  3.56s/it][A
 93%|█████████▎| 25/27 [01:28<00:07,  3.57s/it][A
 96%|█████████▋| 26/27 [01:32<00:03,  3.50s/it][A
100%|██████████| 27/27 [01:35<00:00,  3.48s/it][A100%|██████████| 27/27 [01:35<00:00,  3.54s/it]
Experiment 2 Progress:  14%|█▁        | 2/14 [03:34<21:17, 106.45s/it]✓ Complete - SVM F1: 0.4873, DT F1: 0.3891, RF F1: 0.4663

--------------------------------------------------------------------------------
Config 3/14: Window=170, Overlap=17
--------------------------------------------------------------------------------
[FILTER] Applying Low-pass Filter (cutoff=5Hz, order=4)
Generated 27945 samples, training models...

  0%|          | 0/27 [00:00<?, ?it/s][A
  4%|▎         | 1/27 [00:04<01:47,  4.14s/it][A
  7%|▋         | 2/27 [00:07<01:27,  3.51s/it][A
 11%|█         | 3/27 [00:10<01:19,  3.31s/it][A
 15%|█▁        | 4/27 [00:13<01:13,  3.20s/it][A
 19%|█▊        | 5/27 [00:16<01:09,  3.18s/it][A
 22%|██▁       | 6/27 [00:19<01:05,  3.14s/it][A
 26%|██▌       | 7/27 [00:22<01:03,  3.17s/it][A
 30%|██▉       | 8/27 [00:25<01:00,  3.18s/it][A
 33%|███▎      | 9/27 [00:29<00:56,  3.15s/it][A
 37%|███▋      | 10/27 [00:32<00:52,  3.12s/it][A
 41%|████      | 11/27 [00:35<00:51,  3.24s/it][A
 44%|████▁     | 12/27 [00:38<00:47,  3.19s/it][A
 48%|████▊     | 13/27 [00:42<00:46,  3.32s/it][A
 52%|█████▁    | 14/27 [00:45<00:42,  3.26s/it][A
 56%|█████▌    | 15/27 [00:48<00:38,  3.21s/it][A
 59%|█████▉    | 16/27 [00:51<00:34,  3.17s/it][A
 63%|██████▎   | 17/27 [00:54<00:31,  3.14s/it][A
 67%|██████▋   | 18/27 [00:57<00:28,  3.20s/it][A
 70%|███████   | 19/27 [01:01<00:25,  3.15s/it][A
 74%|███████▁  | 20/27 [01:04<00:21,  3.12s/it][A
 78%|███████▊  | 21/27 [01:07<00:18,  3.17s/it][A
 81%|████████▁ | 22/27 [01:10<00:15,  3.18s/it][A
 85%|████████▌ | 23/27 [01:13<00:12,  3.21s/it][A
 89%|████████▉ | 24/27 [01:17<00:09,  3.21s/it][A
 93%|█████████▎| 25/27 [01:20<00:06,  3.23s/it][A
 96%|█████████▋| 26/27 [01:23<00:03,  3.18s/it][A
100%|██████████| 27/27 [01:26<00:00,  3.15s/it][A100%|██████████| 27/27 [01:26<00:00,  3.20s/it]
Experiment 2 Progress:  21%|██▁       | 3/14 [05:07<18:21, 100.11s/it]✓ Complete - SVM F1: 0.4865, DT F1: 0.3901, RF F1: 0.4678

--------------------------------------------------------------------------------
Config 4/14: Window=170, Overlap=18
--------------------------------------------------------------------------------
[FILTER] Applying Low-pass Filter (cutoff=5Hz, order=4)
Generated 26394 samples, training models...

  0%|          | 0/27 [00:00<?, ?it/s][A
  4%|▎         | 1/27 [00:03<01:37,  3.74s/it][A
  7%|▋         | 2/27 [00:06<01:20,  3.21s/it][A
 11%|█         | 3/27 [00:09<01:12,  3.02s/it][A
 15%|█▁        | 4/27 [00:12<01:07,  2.93s/it][A
 19%|█▊        | 5/27 [00:15<01:03,  2.90s/it][A
 22%|██▁       | 6/27 [00:17<01:00,  2.86s/it][A
 26%|██▌       | 7/27 [00:20<00:57,  2.90s/it][A
 30%|██▉       | 8/27 [00:23<00:55,  2.91s/it][A
 33%|███▎      | 9/27 [00:26<00:51,  2.87s/it][A
 37%|███▋      | 10/27 [00:29<00:48,  2.85s/it][A
 41%|████      | 11/27 [00:32<00:47,  2.96s/it][A
 44%|████▁     | 12/27 [00:35<00:43,  2.93s/it][A
 48%|████▊     | 13/27 [00:38<00:42,  3.03s/it][A
 52%|█████▁    | 14/27 [00:41<00:38,  2.98s/it][A
 56%|█████▌    | 15/27 [00:44<00:35,  2.94s/it][A
 59%|█████▉    | 16/27 [00:47<00:31,  2.90s/it][A
 63%|██████▎   | 17/27 [00:49<00:28,  2.87s/it][A
 67%|██████▋   | 18/27 [00:53<00:26,  2.94s/it][A
 70%|███████   | 19/27 [00:55<00:23,  2.90s/it][A
 74%|███████▁  | 20/27 [00:58<00:20,  2.87s/it][A
 78%|███████▊  | 21/27 [01:01<00:17,  2.91s/it][A
 81%|████████▁ | 22/27 [01:04<00:14,  2.92s/it][A
 85%|████████▌ | 23/27 [01:07<00:11,  2.95s/it][A
 89%|████████▉ | 24/27 [01:10<00:08,  2.95s/it][A
 93%|█████████▎| 25/27 [01:13<00:05,  2.96s/it][A
 96%|█████████▋| 26/27 [01:16<00:02,  2.93s/it][A
100%|██████████| 27/27 [01:19<00:00,  2.89s/it][A100%|██████████| 27/27 [01:19<00:00,  2.93s/it]
Experiment 2 Progress:  29%|██▊       | 4/14 [06:32<15:41, 94.18s/it] ✓ Complete - SVM F1: 0.4884, DT F1: 0.3914, RF F1: 0.4717

--------------------------------------------------------------------------------
Config 5/14: Window=170, Overlap=19
--------------------------------------------------------------------------------
[FILTER] Applying Low-pass Filter (cutoff=5Hz, order=4)
Generated 25002 samples, training models...

  0%|          | 0/27 [00:00<?, ?it/s][A
  4%|▎         | 1/27 [00:03<01:27,  3.37s/it][A
  7%|▋         | 2/27 [00:05<01:12,  2.92s/it][A
 11%|█         | 3/27 [00:08<01:06,  2.76s/it][A
 15%|█▁        | 4/27 [00:11<01:01,  2.69s/it][A
 19%|█▊        | 5/27 [00:13<00:58,  2.65s/it][A
 22%|██▁       | 6/27 [00:16<00:55,  2.63s/it][A
 26%|██▌       | 7/27 [00:18<00:53,  2.65s/it][A
 30%|██▉       | 8/27 [00:21<00:50,  2.66s/it][A
 33%|███▎      | 9/27 [00:24<00:47,  2.64s/it][A
 37%|███▋      | 10/27 [00:26<00:44,  2.63s/it][A
 41%|████      | 11/27 [00:29<00:43,  2.72s/it][A
 44%|████▁     | 12/27 [00:32<00:40,  2.69s/it][A
 48%|████▊     | 13/27 [00:35<00:38,  2.79s/it][A
 52%|█████▁    | 14/27 [00:38<00:35,  2.74s/it][A
 56%|█████▌    | 15/27 [00:40<00:32,  2.70s/it][A
 59%|█████▉    | 16/27 [00:43<00:29,  2.67s/it][A
 63%|██████▎   | 17/27 [00:45<00:26,  2.67s/it][A
 67%|██████▋   | 18/27 [00:48<00:24,  2.72s/it][A
 70%|███████   | 19/27 [00:51<00:21,  2.68s/it][A
 74%|███████▁  | 20/27 [00:53<00:18,  2.65s/it][A
 78%|███████▊  | 21/27 [00:56<00:16,  2.69s/it][A
 81%|████████▁ | 22/27 [00:59<00:13,  2.69s/it][A
 85%|████████▌ | 23/27 [01:02<00:10,  2.71s/it][A
 89%|████████▉ | 24/27 [01:04<00:08,  2.71s/it][A
 93%|█████████▎| 25/27 [01:07<00:05,  2.71s/it][A
 96%|█████████▋| 26/27 [01:10<00:02,  2.68s/it][A
100%|██████████| 27/27 [01:12<00:00,  2.66s/it][A100%|██████████| 27/27 [01:12<00:00,  2.70s/it]
Experiment 2 Progress:  36%|███▌      | 5/14 [07:50<13:15, 88.44s/it]✓ Complete - SVM F1: 0.4862, DT F1: 0.3859, RF F1: 0.4675

--------------------------------------------------------------------------------
Config 6/14: Window=170, Overlap=20
--------------------------------------------------------------------------------
[FILTER] Applying Low-pass Filter (cutoff=5Hz, order=4)
Generated 23757 samples, training models...

  0%|          | 0/27 [00:00<?, ?it/s][A
  4%|▎         | 1/27 [00:03<01:20,  3.11s/it][A
  7%|▋         | 2/27 [00:05<01:07,  2.68s/it][A
 11%|█         | 3/27 [00:07<01:01,  2.55s/it][A
 15%|█▁        | 4/27 [00:10<00:57,  2.49s/it][A
 19%|█▊        | 5/27 [00:12<00:53,  2.45s/it][A
 22%|██▁       | 6/27 [00:15<00:50,  2.43s/it][A
 26%|██▌       | 7/27 [00:17<00:49,  2.45s/it][A
 30%|██▉       | 8/27 [00:20<00:46,  2.46s/it][A
 33%|███▎      | 9/27 [00:22<00:43,  2.44s/it][A
 37%|███▋      | 10/27 [00:24<00:41,  2.43s/it][A
 41%|████      | 11/27 [00:27<00:40,  2.52s/it][A
 44%|████▁     | 12/27 [00:29<00:37,  2.49s/it][A
 48%|████▊     | 13/27 [00:32<00:36,  2.57s/it][A
 52%|█████▁    | 14/27 [00:35<00:32,  2.52s/it][A
 56%|█████▌    | 15/27 [00:37<00:29,  2.49s/it][A
 59%|█████▉    | 16/27 [00:39<00:27,  2.46s/it][A
 63%|██████▎   | 17/27 [00:42<00:24,  2.44s/it][A
 67%|██████▋   | 18/27 [00:44<00:22,  2.48s/it][A
 70%|███████   | 19/27 [00:47<00:19,  2.47s/it][A
 74%|███████▁  | 20/27 [00:49<00:17,  2.45s/it][A
 78%|███████▊  | 21/27 [00:52<00:14,  2.46s/it][A
 81%|████████▁ | 22/27 [00:54<00:12,  2.47s/it][A
 85%|████████▌ | 23/27 [00:57<00:10,  2.51s/it][A
 89%|████████▉ | 24/27 [00:59<00:07,  2.51s/it][A
 93%|█████████▎| 25/27 [01:02<00:05,  2.50s/it][A
 96%|█████████▋| 26/27 [01:04<00:02,  2.47s/it][A
100%|██████████| 27/27 [01:07<00:00,  2.46s/it][A100%|██████████| 27/27 [01:07<00:00,  2.49s/it]
Experiment 2 Progress:  43%|████▎     | 6/14 [09:03<11:03, 82.97s/it]✓ Complete - SVM F1: 0.4883, DT F1: 0.4007, RF F1: 0.4722

--------------------------------------------------------------------------------
Config 7/14: Window=170, Overlap=21
--------------------------------------------------------------------------------
[FILTER] Applying Low-pass Filter (cutoff=5Hz, order=4)
Generated 22625 samples, training models...

  0%|          | 0/27 [00:00<?, ?it/s][A
  4%|▎         | 1/27 [00:02<01:15,  2.89s/it][A
  7%|▋         | 2/27 [00:05<01:02,  2.49s/it][A
 11%|█         | 3/27 [00:07<00:56,  2.37s/it][A
 15%|█▁        | 4/27 [00:09<00:52,  2.30s/it][A
 19%|█▊        | 5/27 [00:11<00:49,  2.27s/it][A
 22%|██▁       | 6/27 [00:13<00:47,  2.24s/it][A
 26%|██▌       | 7/27 [00:16<00:45,  2.27s/it][A
 30%|██▉       | 8/27 [00:18<00:43,  2.28s/it][A
 33%|███▎      | 9/27 [00:20<00:40,  2.26s/it][A
 37%|███▋      | 10/27 [00:22<00:38,  2.24s/it][A
 41%|████      | 11/27 [00:25<00:37,  2.31s/it][A
 44%|████▁     | 12/27 [00:27<00:34,  2.29s/it][A
 48%|████▊     | 13/27 [00:30<00:33,  2.36s/it][A
 52%|█████▁    | 14/27 [00:32<00:30,  2.32s/it][A
 56%|█████▌    | 15/27 [00:34<00:27,  2.29s/it][A
 59%|█████▉    | 16/27 [00:36<00:25,  2.27s/it][A
 63%|██████▎   | 17/27 [00:39<00:22,  2.26s/it][A
 67%|██████▋   | 18/27 [00:41<00:20,  2.30s/it][A
 70%|███████   | 19/27 [00:43<00:18,  2.28s/it][A
 74%|███████▁  | 20/27 [00:45<00:15,  2.26s/it][A
 78%|███████▊  | 21/27 [00:48<00:13,  2.28s/it][A
 81%|████████▁ | 22/27 [00:50<00:11,  2.28s/it][A
 85%|████████▌ | 23/27 [00:52<00:09,  2.30s/it][A
 89%|████████▉ | 24/27 [00:55<00:06,  2.31s/it][A
 93%|█████████▎| 25/27 [00:57<00:04,  2.31s/it][A
 96%|█████████▋| 26/27 [00:59<00:02,  2.29s/it][A
100%|██████████| 27/27 [01:02<00:00,  2.27s/it][A100%|██████████| 27/27 [01:02<00:00,  2.30s/it]
Experiment 2 Progress:  50%|█████     | 7/14 [10:10<09:04, 77.75s/it]✓ Complete - SVM F1: 0.4882, DT F1: 0.3949, RF F1: 0.4713

--------------------------------------------------------------------------------
Config 8/14: Window=170, Overlap=22
--------------------------------------------------------------------------------
[FILTER] Applying Low-pass Filter (cutoff=5Hz, order=4)
Generated 21596 samples, training models...

  0%|          | 0/27 [00:00<?, ?it/s][A
  4%|▎         | 1/27 [00:02<01:08,  2.65s/it][A
  7%|▋         | 2/27 [00:04<00:57,  2.30s/it][A
 11%|█         | 3/27 [00:06<00:52,  2.19s/it][A
 15%|█▁        | 4/27 [00:08<00:48,  2.13s/it][A
 19%|█▊        | 5/27 [00:10<00:46,  2.09s/it][A
 22%|██▁       | 6/27 [00:12<00:43,  2.07s/it][A
 26%|██▌       | 7/27 [00:14<00:41,  2.09s/it][A
 30%|██▉       | 8/27 [00:17<00:40,  2.11s/it][A
 33%|███▎      | 9/27 [00:19<00:37,  2.09s/it][A
 37%|███▋      | 10/27 [00:21<00:35,  2.08s/it][A
 41%|████      | 11/27 [00:23<00:34,  2.16s/it][A
 44%|████▁     | 12/27 [00:25<00:31,  2.13s/it][A
 48%|████▊     | 13/27 [00:27<00:30,  2.20s/it][A
 52%|█████▁    | 14/27 [00:30<00:28,  2.16s/it][A
 56%|█████▌    | 15/27 [00:32<00:25,  2.13s/it][A
 59%|█████▉    | 16/27 [00:34<00:23,  2.10s/it][A
 63%|██████▎   | 17/27 [00:36<00:20,  2.08s/it][A
 67%|██████▋   | 18/27 [00:38<00:19,  2.13s/it][A
 70%|███████   | 19/27 [00:40<00:16,  2.10s/it][A
 74%|███████▁  | 20/27 [00:42<00:14,  2.09s/it][A
 78%|███████▊  | 21/27 [00:44<00:12,  2.12s/it][A
 81%|████████▁ | 22/27 [00:46<00:10,  2.12s/it][A
 85%|████████▌ | 23/27 [00:49<00:08,  2.13s/it][A
 89%|████████▉ | 24/27 [00:51<00:06,  2.15s/it][A
 93%|█████████▎| 25/27 [00:53<00:04,  2.15s/it][A
 96%|█████████▋| 26/27 [00:55<00:02,  2.12s/it][A
100%|██████████| 27/27 [00:57<00:00,  2.11s/it][A100%|██████████| 27/27 [00:57<00:00,  2.13s/it]
Experiment 2 Progress:  57%|█████▋    | 8/14 [11:12<07:16, 72.81s/it]✓ Complete - SVM F1: 0.4851, DT F1: 0.4038, RF F1: 0.4711

--------------------------------------------------------------------------------
Config 9/14: Window=170, Overlap=25
--------------------------------------------------------------------------------
[FILTER] Applying Low-pass Filter (cutoff=5Hz, order=4)
Generated 19006 samples, training models...

  0%|          | 0/27 [00:00<?, ?it/s][A
  4%|▎         | 1/27 [00:02<00:54,  2.11s/it][A
  7%|▋         | 2/27 [00:03<00:46,  1.86s/it][A
 11%|█         | 3/27 [00:05<00:43,  1.79s/it][A
 15%|█▁        | 4/27 [00:07<00:40,  1.77s/it][A
 19%|█▊        | 5/27 [00:08<00:38,  1.74s/it][A
 22%|██▁       | 6/27 [00:10<00:36,  1.72s/it][A
 26%|██▌       | 7/27 [00:12<00:34,  1.74s/it][A
 30%|██▉       | 8/27 [00:14<00:33,  1.74s/it][A
 33%|███▎      | 9/27 [00:15<00:31,  1.72s/it][A
 37%|███▋      | 10/27 [00:17<00:29,  1.71s/it][A
 41%|████      | 11/27 [00:19<00:28,  1.77s/it][A
 44%|████▁     | 12/27 [00:21<00:26,  1.75s/it][A
 48%|████▊     | 13/27 [00:23<00:25,  1.80s/it][A
 52%|█████▁    | 14/27 [00:24<00:23,  1.77s/it][A
 56%|█████▌    | 15/27 [00:26<00:20,  1.75s/it][A
 59%|█████▉    | 16/27 [00:28<00:18,  1.73s/it][A
 63%|██████▎   | 17/27 [00:29<00:17,  1.71s/it][A
 67%|██████▋   | 18/27 [00:31<00:15,  1.75s/it][A
 70%|███████   | 19/27 [00:33<00:13,  1.73s/it][A
 74%|███████▁  | 20/27 [00:35<00:12,  1.72s/it][A
 78%|███████▊  | 21/27 [00:36<00:10,  1.74s/it][A
 81%|████████▁ | 22/27 [00:38<00:08,  1.74s/it][A
 85%|████████▌ | 23/27 [00:40<00:07,  1.75s/it][A
 89%|████████▉ | 24/27 [00:42<00:05,  1.76s/it][A
 93%|█████████▎| 25/27 [00:43<00:03,  1.76s/it][A
 96%|█████████▋| 26/27 [00:45<00:01,  1.74s/it][A
100%|██████████| 27/27 [00:47<00:00,  1.73s/it][A100%|██████████| 27/27 [00:47<00:00,  1.75s/it]
Experiment 2 Progress:  64%|██████▁   | 9/14 [12:03<05:30, 66.16s/it]✓ Complete - SVM F1: 0.4835, DT F1: 0.4018, RF F1: 0.4755

--------------------------------------------------------------------------------
Config 10/14: Window=170, Overlap=30
--------------------------------------------------------------------------------
[FILTER] Applying Low-pass Filter (cutoff=5Hz, order=4)
Generated 15843 samples, training models...

  0%|          | 0/27 [00:00<?, ?it/s][A
  4%|▎         | 1/27 [00:01<00:40,  1.57s/it][A
  7%|▋         | 2/27 [00:02<00:35,  1.42s/it][A
 11%|█         | 3/27 [00:04<00:32,  1.37s/it][A
 15%|█▁        | 4/27 [00:05<00:30,  1.34s/it][A
 19%|█▊        | 5/27 [00:06<00:29,  1.32s/it][A
 22%|██▁       | 6/27 [00:08<00:27,  1.31s/it][A
 26%|██▌       | 7/27 [00:09<00:26,  1.32s/it][A
 30%|██▉       | 8/27 [00:10<00:25,  1.33s/it][A
 33%|███▎      | 9/27 [00:12<00:23,  1.32s/it][A
 37%|███▋      | 10/27 [00:13<00:22,  1.31s/it][A
 41%|████      | 11/27 [00:14<00:21,  1.34s/it][A
 44%|████▁     | 12/27 [00:16<00:19,  1.33s/it][A
 48%|████▊     | 13/27 [00:17<00:19,  1.37s/it][A
 52%|█████▁    | 14/27 [00:18<00:17,  1.35s/it][A
 56%|█████▌    | 15/27 [00:20<00:16,  1.34s/it][A
 59%|█████▉    | 16/27 [00:21<00:14,  1.33s/it][A
 63%|██████▎   | 17/27 [00:22<00:13,  1.32s/it][A
 67%|██████▋   | 18/27 [00:24<00:12,  1.34s/it][A
 70%|███████   | 19/27 [00:25<00:10,  1.33s/it][A
 74%|███████▁  | 20/27 [00:26<00:09,  1.32s/it][A
 78%|███████▊  | 21/27 [00:28<00:08,  1.34s/it][A
 81%|████████▁ | 22/27 [00:29<00:06,  1.34s/it][A
 85%|████████▌ | 23/27 [00:30<00:05,  1.35s/it][A
 89%|████████▉ | 24/27 [00:32<00:04,  1.36s/it][A
 93%|█████████▎| 25/27 [00:33<00:02,  1.36s/it][A
 96%|█████████▋| 26/27 [00:34<00:01,  1.35s/it][A
100%|██████████| 27/27 [00:36<00:00,  1.34s/it][A100%|██████████| 27/27 [00:36<00:00,  1.34s/it]
Experiment 2 Progress:  71%|███████▁  | 10/14 [12:43<03:52, 58.01s/it]✓ Complete - SVM F1: 0.4854, DT F1: 0.3891, RF F1: 0.4704

--------------------------------------------------------------------------------
Config 11/14: Window=170, Overlap=35
--------------------------------------------------------------------------------
[FILTER] Applying Low-pass Filter (cutoff=5Hz, order=4)
Generated 13582 samples, training models...

  0%|          | 0/27 [00:00<?, ?it/s][A
  4%|▎         | 1/27 [00:01<00:31,  1.20s/it][A
  7%|▋         | 2/27 [00:02<00:27,  1.10s/it][A
 11%|█         | 3/27 [00:03<00:25,  1.08s/it][A
 15%|█▁        | 4/27 [00:04<00:24,  1.06s/it][A
 19%|█▊        | 5/27 [00:05<00:23,  1.05s/it][A
 22%|██▁       | 6/27 [00:06<00:22,  1.05s/it][A
 26%|██▌       | 7/27 [00:07<00:21,  1.06s/it][A
 30%|██▉       | 8/27 [00:08<00:20,  1.06s/it][A
 33%|███▎      | 9/27 [00:09<00:19,  1.06s/it][A
 37%|███▋      | 10/27 [00:10<00:17,  1.05s/it][A
 41%|████      | 11/27 [00:11<00:17,  1.08s/it][A
 44%|████▁     | 12/27 [00:12<00:15,  1.07s/it][A
 48%|████▊     | 13/27 [00:13<00:15,  1.09s/it][A
 52%|█████▁    | 14/27 [00:15<00:14,  1.08s/it][A
 56%|█████▌    | 15/27 [00:16<00:12,  1.07s/it][A
 59%|█████▉    | 16/27 [00:17<00:11,  1.06s/it][A
 63%|██████▎   | 17/27 [00:18<00:10,  1.06s/it][A
 67%|██████▋   | 18/27 [00:19<00:09,  1.07s/it][A
 70%|███████   | 19/27 [00:20<00:08,  1.06s/it][A
 74%|███████▁  | 20/27 [00:21<00:07,  1.06s/it][A
 78%|███████▊  | 21/27 [00:22<00:06,  1.07s/it][A
 81%|████████▁ | 22/27 [00:23<00:05,  1.06s/it][A
 85%|████████▌ | 23/27 [00:24<00:04,  1.07s/it][A
 89%|████████▉ | 24/27 [00:25<00:03,  1.07s/it][A
 93%|█████████▎| 25/27 [00:26<00:02,  1.09s/it][A
 96%|█████████▋| 26/27 [00:27<00:01,  1.08s/it][A
100%|██████████| 27/27 [00:28<00:00,  1.06s/it][A100%|██████████| 27/27 [00:28<00:00,  1.07s/it]
Experiment 2 Progress:  79%|███████▊  | 11/14 [13:15<02:30, 50.04s/it]✓ Complete - SVM F1: 0.4864, DT F1: 0.3994, RF F1: 0.4686

--------------------------------------------------------------------------------
Config 12/14: Window=170, Overlap=40
--------------------------------------------------------------------------------
[FILTER] Applying Low-pass Filter (cutoff=5Hz, order=4)
Generated 11890 samples, training models...

  0%|          | 0/27 [00:00<?, ?it/s][A
  4%|▎         | 1/27 [00:00<00:25,  1.03it/s][A
  7%|▋         | 2/27 [00:01<00:22,  1.11it/s][A
 11%|█         | 3/27 [00:02<00:21,  1.12it/s][A
 15%|█▁        | 4/27 [00:03<00:20,  1.14it/s][A
 19%|█▊        | 5/27 [00:04<00:19,  1.14it/s][A
 22%|██▁       | 6/27 [00:05<00:18,  1.15it/s][A
 26%|██▌       | 7/27 [00:06<00:17,  1.14it/s][A
 30%|██▉       | 8/27 [00:07<00:16,  1.13it/s][A
 33%|███▎      | 9/27 [00:07<00:15,  1.14it/s][A
 37%|███▋      | 10/27 [00:08<00:14,  1.14it/s][A
 41%|████      | 11/27 [00:09<00:14,  1.11it/s][A
 44%|████▁     | 12/27 [00:10<00:13,  1.12it/s][A
 48%|████▊     | 13/27 [00:11<00:12,  1.10it/s][A
 52%|█████▁    | 14/27 [00:12<00:11,  1.12it/s][A
 56%|█████▌    | 15/27 [00:13<00:10,  1.13it/s][A
 59%|█████▉    | 16/27 [00:14<00:09,  1.13it/s][A
 63%|██████▎   | 17/27 [00:15<00:08,  1.14it/s][A
 67%|██████▋   | 18/27 [00:15<00:07,  1.13it/s][A
 70%|███████   | 19/27 [00:16<00:07,  1.14it/s][A
 74%|███████▁  | 20/27 [00:17<00:06,  1.14it/s][A
 78%|███████▊  | 21/27 [00:18<00:05,  1.14it/s][A
 81%|████████▁ | 22/27 [00:19<00:04,  1.14it/s][A
 85%|████████▌ | 23/27 [00:20<00:03,  1.13it/s][A
 89%|████████▉ | 24/27 [00:21<00:02,  1.11it/s][A
 93%|█████████▎| 25/27 [00:22<00:01,  1.11it/s][A
 96%|█████████▋| 26/27 [00:23<00:00,  1.12it/s][A
100%|██████████| 27/27 [00:23<00:00,  1.13it/s][A100%|██████████| 27/27 [00:23<00:00,  1.13it/s]
Experiment 2 Progress:  86%|████████▌ | 12/14 [13:42<01:25, 42.94s/it]✓ Complete - SVM F1: 0.4820, DT F1: 0.4005, RF F1: 0.4747

--------------------------------------------------------------------------------
Config 13/14: Window=170, Overlap=50
--------------------------------------------------------------------------------
[FILTER] Applying Low-pass Filter (cutoff=5Hz, order=4)
Generated 9513 samples, training models...

  0%|          | 0/27 [00:00<?, ?it/s][A
  4%|▎         | 1/27 [00:00<00:17,  1.47it/s][A
  7%|▋         | 2/27 [00:01<00:16,  1.53it/s][A
 11%|█         | 3/27 [00:01<00:15,  1.55it/s][A
 15%|█▁        | 4/27 [00:02<00:14,  1.56it/s][A
 19%|█▊        | 5/27 [00:03<00:14,  1.56it/s][A
 22%|██▁       | 6/27 [00:03<00:13,  1.57it/s][A
 26%|██▌       | 7/27 [00:04<00:12,  1.56it/s][A
 30%|██▉       | 8/27 [00:05<00:12,  1.55it/s][A
 33%|███▎      | 9/27 [00:05<00:11,  1.56it/s][A
 37%|███▋      | 10/27 [00:06<00:10,  1.57it/s][A
 41%|████      | 11/27 [00:07<00:10,  1.54it/s][A
 44%|████▁     | 12/27 [00:07<00:09,  1.54it/s][A
 48%|████▊     | 13/27 [00:08<00:09,  1.52it/s][A
 52%|█████▁    | 14/27 [00:09<00:08,  1.53it/s][A
 56%|█████▌    | 15/27 [00:09<00:07,  1.54it/s][A
 59%|█████▉    | 16/27 [00:10<00:07,  1.56it/s][A
 63%|██████▎   | 17/27 [00:10<00:06,  1.57it/s][A
 67%|██████▋   | 18/27 [00:11<00:05,  1.55it/s][A
 70%|███████   | 19/27 [00:12<00:05,  1.56it/s][A
 74%|███████▁  | 20/27 [00:12<00:04,  1.56it/s][A
 78%|███████▊  | 21/27 [00:13<00:03,  1.55it/s][A
 81%|████████▁ | 22/27 [00:14<00:03,  1.55it/s][A
 85%|████████▌ | 23/27 [00:14<00:02,  1.51it/s][A
 89%|████████▉ | 24/27 [00:15<00:01,  1.52it/s][A
 93%|█████████▎| 25/27 [00:16<00:01,  1.53it/s][A
 96%|█████████▋| 26/27 [00:16<00:00,  1.54it/s][A
100%|██████████| 27/27 [00:17<00:00,  1.56it/s][A100%|██████████| 27/27 [00:17<00:00,  1.55it/s]
Experiment 2 Progress:  93%|█████████▎| 13/14 [14:01<00:35, 35.90s/it]✓ Complete - SVM F1: 0.4766, DT F1: 0.3888, RF F1: 0.4705

--------------------------------------------------------------------------------
Config 14/14: Window=170, Overlap=70
--------------------------------------------------------------------------------
[FILTER] Applying Low-pass Filter (cutoff=5Hz, order=4)
Generated 6802 samples, training models...

  0%|          | 0/27 [00:00<?, ?it/s][A
  4%|▎         | 1/27 [00:00<00:11,  2.36it/s][A
  7%|▋         | 2/27 [00:00<00:10,  2.40it/s][A
 11%|█         | 3/27 [00:01<00:09,  2.42it/s][A
 15%|█▁        | 4/27 [00:01<00:09,  2.43it/s][A
 19%|█▊        | 5/27 [00:02<00:09,  2.43it/s][A
 22%|██▁       | 6/27 [00:02<00:08,  2.42it/s][A
 26%|██▌       | 7/27 [00:02<00:08,  2.40it/s][A
 30%|██▉       | 8/27 [00:03<00:07,  2.39it/s][A
 33%|███▎      | 9/27 [00:03<00:07,  2.40it/s][A
 37%|███▋      | 10/27 [00:04<00:07,  2.39it/s][A
 41%|████      | 11/27 [00:04<00:06,  2.36it/s][A
 44%|████▁     | 12/27 [00:05<00:06,  2.37it/s][A
 48%|████▊     | 13/27 [00:05<00:05,  2.36it/s][A
 52%|█████▁    | 14/27 [00:05<00:05,  2.37it/s][A
 56%|█████▌    | 15/27 [00:06<00:04,  2.40it/s][A
 59%|█████▉    | 16/27 [00:06<00:04,  2.41it/s][A
 63%|██████▎   | 17/27 [00:07<00:04,  2.40it/s][A
 67%|██████▋   | 18/27 [00:07<00:03,  2.38it/s][A
 70%|███████   | 19/27 [00:07<00:03,  2.40it/s][A
 74%|███████▁  | 20/27 [00:08<00:02,  2.41it/s][A
 78%|███████▊  | 21/27 [00:08<00:02,  2.40it/s][A
 81%|████████▁ | 22/27 [00:09<00:02,  2.31it/s][A
 85%|████████▌ | 23/27 [00:09<00:01,  2.33it/s][A
 89%|████████▉ | 24/27 [00:10<00:01,  2.34it/s][A
 93%|█████████▎| 25/27 [00:10<00:00,  2.35it/s][A
 96%|█████████▋| 26/27 [00:10<00:00,  2.38it/s][A
100%|██████████| 27/27 [00:11<00:00,  2.37it/s][A100%|██████████| 27/27 [00:11<00:00,  2.38it/s]
Experiment 2 Progress: 100%|██████████| 14/14 [14:14<00:00, 28.99s/it]Experiment 2 Progress: 100%|██████████| 14/14 [14:14<00:00, 61.07s/it]
/home/odin/achal/Pervasive-Computing-for-Health/tutorial_3/experiments.py:592: MatplotlibDeprecationWarning: The 'labels' parameter of boxplot() has been renamed 'tick_labels' since Matplotlib 3.9; support for the old name will be dropped in 3.11.
  bp = ax1.boxplot(data_to_plot, labels=models, patch_artist=True,
✓ Complete - SVM F1: 0.4674, DT F1: 0.3948, RF F1: 0.4712

================================================================================
Experiment 2 Complete - Tested 14 configurations
================================================================================

Results saved to: /home/odin/achal/Pervasive-Computing-for-Health/tutorial_3/results/run_20260205_173221/experiment2_overlap_sweep_20260205_173221.csv

================================================================================
GENERATING PLOTS
================================================================================
Model comparison plot saved: /home/odin/achal/Pervasive-Computing-for-Health/tutorial_3/results/run_20260205_173221/model_comparison_20260205_173221.png
Distribution plot saved: /home/odin/achal/Pervasive-Computing-for-Health/tutorial_3/results/run_20260205_173221/performance_distribution_20260205_173221.png

================================================================================
EXPERIMENT SUMMARY
================================================================================
 window_size  overlap  overlap_percent  num_samples   svm_f1    dt_f1    rf_f1
         170       15                8        31666 0.486050 0.379384 0.465257
         170       16                9        29688 0.487329 0.389056 0.466279
         170       17               10        27945 0.486494 0.390078 0.467837
         170       18               10        26394 0.488370 0.391370 0.471704
         170       19               11        25002 0.486178 0.385922 0.467518
         170       20               11        23757 0.488326 0.400693 0.472218
         170       21               12        22625 0.488228 0.394898 0.471350
         170       22               12        21596 0.485131 0.403822 0.471096
         170       25               14        19006 0.483461 0.401811 0.475461
         170       30               17        15843 0.485403 0.389113 0.470353
         170       35               20        13582 0.486401 0.399444 0.468624
         170       40               23        11890 0.482042 0.400524 0.474690
         170       50               29         9513 0.476581 0.388773 0.470507
         170       70               41         6802 0.467449 0.394779 0.471184

✓ Best Configuration:
  Window: 170
  Overlap: 18
  SVM F1: 0.4884
  RF F1: 0.4717
  DT F1: 0.3914

================================================================================
EXPERIMENT COMPLETE - 2026-02-05 17:46:39
Results saved to: /home/odin/achal/Pervasive-Computing-for-Health/tutorial_3/results/run_20260205_173221
================================================================================
